activity_id,assay_chembl_id,assay_description,canonical_smiles,data_validity_comment,data_validity_description,document_chembl_id,document_journal,document_year,molecule_chembl_id,molecule_pref_name,parent_molecule_chembl_id,pchembl_value,record_id,relation,src_id,standard_flag,standard_relation,standard_text_value,standard_type,standard_units,standard_value,target_chembl_id,target_organism,target_pref_name,target_tax_id,type,units,uo_units,value,activity_label
32380,CHEMBL763979,Inhibition of human platelet aggregation induced by ADP after 3 min incubation with platelet rich plasma,CCC(CC)CN1CCN(S(=O)(=O)CCCOc2ccc3[nH]c4nc(O)nc-4cc3c2)CC1.Cl,,,CHEMBL1126868,J Med Chem,1993,CHEMBL1203068,,CHEMBL111704,9.8,208583,=,1,1,=,,IC50,nM,0.16,CHEMBL372,Homo sapiens,Homo sapiens,9606,IC50,nM,UO_0000065,0.16,0
141560,CHEMBL733698,Inhibition of LPS-stimulated TNF-alpha production in monocyte cells,O=C1NCc2c(-c3ccccc3Cl)cc(N3CCNCC3)cc2N1c1c(Cl)cccc1Cl,,,CHEMBL1136271,Bioorg Med Chem Lett,2003,CHEMBL96487,,CHEMBL96487,8.54,174930,=,1,1,=,,IC50,nM,2.9,CHEMBL372,Homo sapiens,Homo sapiens,9606,IC50,nM,UO_0000065,2.9,0
104500,CHEMBL700456,Inhibition of human platelet (isolated from PRP) aggregation,CC1(c2ccc(CN)cc2)NC(=O)N(CC(=O)N[C@@H](CC(=O)O)C(=O)N[C@H](C(=O)O)c2ccccc2)C1=O,,,CHEMBL1134795,J Med Chem,2001,CHEMBL277734,,CHEMBL277734,6.82,20058,=,1,1,=,,IC50,nM,150.0,CHEMBL372,Homo sapiens,Homo sapiens,9606,IC50,uM,UO_0000065,0.15,1
574253,CHEMBL759885,"Inhibitory activity against platelet aggregation, induced by arachidonic acid in human platelet rich plasma",O=C(O)Cc1cccc(CC2C3CCC(O3)C2c2nc(C(=O)NCCCCC3CCCCC3)co2)c1,,,CHEMBL1126688,J Med Chem,1993,CHEMBL285596,,CHEMBL285596,7.92,47551,=,1,1,=,,IC50,nM,12.0,CHEMBL372,Homo sapiens,Homo sapiens,9606,I50,nM,UO_0000065,12.0,0
587773,CHEMBL759885,"Inhibitory activity against platelet aggregation, induced by arachidonic acid in human platelet rich plasma",O=C(O)COc1ccccc1CC1C2CCC(O2)C1c1nc(C(=O)NCCCCC2CCCCC2)co1,,,CHEMBL1126688,J Med Chem,1993,CHEMBL30832,,CHEMBL30832,8.15,47546,=,1,1,=,,IC50,nM,7.0,CHEMBL372,Homo sapiens,Homo sapiens,9606,I50,nM,UO_0000065,7.0,0
790521,CHEMBL701437,Inhibition of calcium ionophore (A-23187) stimulated leukotriene B4 (LTB4) formation in human neutrophils at 390 nM,O=C(O)CSC(c1ccc(OCc2ccc3ccccc3n2)cc1)(c1ccc(OCc2ccc3ccccc3n2)cc1)c1cccs1,,,CHEMBL1133442,J Med Chem,2000,CHEMBL115781,,CHEMBL115781,7.96,212793,=,1,1,=,,IC50,nM,11.0,CHEMBL372,Homo sapiens,Homo sapiens,9606,IC50,nM,UO_0000065,11.0,0
471423,CHEMBL841662,Inhibition of TNF alpha synthesis in human monocytes,COc1ccc(C(=O)Nc2c(Cl)cncc2Cl)cc1OC1CCCC1,,,CHEMBL1132750,Bioorg Med Chem Lett,2000,CHEMBL42126,PICLAMILAST,CHEMBL42126,8.89,127286,=,1,1,=,,IC50,nM,1.3,CHEMBL372,Homo sapiens,Homo sapiens,9606,IC50,nM,UO_0000065,1.3,0
647654,CHEMBL767676,Test inhibition of LTB4 production in human peripheral blood polymorphonuclear leukocytes (HPMN),O=C1OCc2c1cc1cc(OCc3cccc(C4(O)CCOCC4)c3)ccc1c2-c1ccco1,,,CHEMBL1129067,J Med Chem,1996,CHEMBL340795,,CHEMBL340795,8.3,245878,=,1,1,=,,IC50,nM,5.0,CHEMBL372,Homo sapiens,Homo sapiens,9606,IC50,nM,UO_0000065,5.0,0
63471,CHEMBL764816,Inhibitory activity of Ca-ionophore-A23187-induced Leukotriene B4 (LTB4) release in human polymorphonuclear leukocytes,CN(C)C(=O)c1ccc2oc(NC(CC3CCCCC3)c3ccccc3)nc2c1,,,CHEMBL1127687,J Med Chem,1994,CHEMBL171336,,CHEMBL171336,6.77,341209,=,1,1,=,,IC50,nM,170.0,CHEMBL372,Homo sapiens,Homo sapiens,9606,IC50,uM,UO_0000065,0.17,1
848206,CHEMBL856201,In vitro inhibition of LTB4 biosynthesis in Ca++ ionophore activated human polymorphonuclear (HPMN) leukocytes.,CC(C)(C)Sc1c(CC(C)(C)C(=O)O)n(Cc2ccc(Cl)cc2)c2ccc(OCc3nc4ccccc4o3)cc12,,,CHEMBL1131844,Bioorg Med Chem Lett,1999,CHEMBL78854,,CHEMBL78854,,140796,<,1,1,<,,IC50,nM,7.0,CHEMBL372,Homo sapiens,Homo sapiens,9606,IC50,nM,UO_0000065,7.0,0
53343,CHEMBL763979,Inhibition of human platelet aggregation induced by ADP after 3 min incubation with platelet rich plasma,Cl.Oc1nc2cc3cc(OCCCc4nnnn4C4CCN(Cc5ccc(F)cc5)CC4)ccc3[nH]c-2n1,,,CHEMBL1126868,J Med Chem,1993,CHEMBL1203034,,CHEMBL111162,10.49,208551,=,1,1,=,,IC50,nM,0.032,CHEMBL372,Homo sapiens,Homo sapiens,9606,IC50,nM,UO_0000065,0.032,0
499957,CHEMBL700876,The compound was tested for the inhibition of platelet aggregation,O=C(NC[C@H](NS(=O)(=O)c1ccccc1)C(=O)O)c1cc2sc(CCC3CCNCC3)cc2s1,,,CHEMBL1151496,Bioorg Med Chem Lett,1997,CHEMBL78570,,CHEMBL78570,8.1,335393,=,1,1,=,,IC50,nM,8.0,CHEMBL372,Homo sapiens,Homo sapiens,9606,IC50,nM,UO_0000065,8.0,0
442437,CHEMBL701319,Inhibition of leukotriene B4 production in human whole blood,COC(=O)C1CC2CC1CN2CCOc1ccc(Cc2ccccc2)cc1,,,CHEMBL1134981,Bioorg Med Chem Lett,2002,CHEMBL114591,,CHEMBL114591,6.7,215618,=,1,1,=,,IC50,nM,200.0,CHEMBL372,Homo sapiens,Homo sapiens,9606,IC50,uM,UO_0000065,0.2,1
451448,CHEMBL702719,Compound was tested for inhibition of ADP induced platelet aggregation by using human platelet rich plasma(PRP) assay,CCCCOC(=O)N[C@@H](CNC(=O)c1cc(OCc2ccc(C(=N)N)cc2)no1)C(=O)O.O=C(O)C(F)(F)F,,,CHEMBL1130705,Bioorg Med Chem Lett,1998,CHEMBL117343,,CHEMBL1180224,7.22,222446,=,1,1,=,,IC50,nM,60.0,CHEMBL372,Homo sapiens,Homo sapiens,9606,IC50,nM,UO_0000065,60.0,1
1215179,CHEMBL871976,Inhibition of LPS/IFN-gamma stimulated TNF-alpha release in human peripheral blood mononuclear cells after 3h of incubation.,CN1CCC(O)(c2cn(-c3ccnc(NC4CCCC4)n3)c(-c3cccc(C(F)(F)F)c3)n2)CC1,,,CHEMBL1147483,Bioorg Med Chem Lett,2004,CHEMBL118258,,CHEMBL118258,9.0,227465,=,1,1,=,,IC50,nM,1.0,CHEMBL372,Homo sapiens,Homo sapiens,9606,IC50,uM,UO_0000065,0.001,0
1266259,CHEMBL699000,In vitro inhibition of ADP (0.5 x 10E-9 M)-induced platelet aggregation in human PRP,CCC#CC[C@H](C)[C@H](O)C#CC1[C@H]2C/C(=C/COCC(=O)O)CC2C[C@H]1O,,,CHEMBL1123407,J Med Chem,1986,CHEMBL323744,,CHEMBL323744,9.19,200605,=,1,1,=,,IC50,nM,0.64,CHEMBL372,Homo sapiens,Homo sapiens,9606,IC50,nM,UO_0000065,0.64,0
1111923,CHEMBL761739,In vitro inhibition of the rate of ADP-stimulated human gel-filtered platelet aggregation (PLAGGIN),Nc1cccc(CCc2ccc(C(=O)NC[C@H](NS(=O)(=O)c3ccccc3)C(=O)O)cc2)n1,,,CHEMBL1133445,J Med Chem,2000,CHEMBL123374,,CHEMBL123374,6.85,234741,=,1,1,=,,IC50,nM,140.0,CHEMBL372,Homo sapiens,Homo sapiens,9606,IC50,nM,UO_0000065,140.0,1
57047,CHEMBL763979,Inhibition of human platelet aggregation induced by ADP after 3 min incubation with platelet rich plasma,CC(C)CN1CCC(n2nnnc2CCCOc2ccc3[nH]c4nc(O)nc-4cc3c2)CC1.Cl,Outside typical range,"Values for this activity type are unusually large/small, so may not be accurate",CHEMBL1126868,J Med Chem,1993,CHEMBL1203078,,CHEMBL109373,,208559,=,1,1,=,,IC50,nM,0.0094,CHEMBL372,Homo sapiens,Homo sapiens,9606,IC50,nM,UO_0000065,0.0094,0
804905,CHEMBL701437,Inhibition of calcium ionophore (A-23187) stimulated leukotriene B4 (LTB4) formation in human neutrophils at 390 nM,CC(CCC(=O)[O-])(c1ccc(OCc2ccc3ccccc3n2)cc1)c1ccc(OCc2nc3ccccc3s2)cc1.[Na+],,,CHEMBL1133442,J Med Chem,2000,CHEMBL112614,,CHEMBL326145,7.28,212773,=,1,1,=,,IC50,nM,52.0,CHEMBL372,Homo sapiens,Homo sapiens,9606,IC50,nM,UO_0000065,52.0,1
1120001,CHEMBL873206,In vitro inhibitory activity against LTB4 synthesis in A-23187 stimulated human whole blood (HB1).,CC(=O)O/N=C(\C)c1ccc(Sc2cc(F)cc(C3CCOCC3)c2)cc1,,,CHEMBL1129182,Bioorg Med Chem Lett,1996,CHEMBL28275,,CHEMBL28275,7.3,36593,=,1,1,=,,IC50,nM,50.0,CHEMBL372,Homo sapiens,Homo sapiens,9606,IC50,uM,UO_0000065,0.05,1
1401490,CHEMBL834299,In vitro metabolic stability of compound was tested in human liver microsomes,CO[C@H]1CC[C@@H](C(=O)c2ccc3nc4c(cc3c2)CCCCC4)CC1,,,CHEMBL1144351,J Med Chem,2005,CHEMBL178741,,CHEMBL178741,7.22,360278,=,1,1,=,,IC50,nM,60.0,CHEMBL372,Homo sapiens,Homo sapiens,9606,IC50,nM,UO_0000065,60.0,1
1268172,CHEMBL842873,In vitro inhibition of 5.86 uM ADP-induced human platelet aggregation in platelet rich plasma (PRP),c1ccc(-c2nc(-c3ncoc3-c3cccc(OCc4nn[nH]n4)c3)oc2-c2ccccc2)cc1,,,CHEMBL1126926,J Med Chem,1993,CHEMBL126139,,CHEMBL126139,6.89,242933,=,1,1,=,,IC50,nM,130.0,CHEMBL372,Homo sapiens,Homo sapiens,9606,IC50,uM,UO_0000065,0.13,1
177865,CHEMBL811521,Concentration required to reduce the proliferation of PHA stimulated human peripheral blood T lymphocytes,C=Cc1cn(COC(CO)CO)c(=O)[nH]c1=O,,,CHEMBL1133838,Bioorg Med Chem Lett,2001,CHEMBL99533,,CHEMBL99533,,184062,>,1,1,>,,IC50,ug.mL-1,50.0,CHEMBL372,Homo sapiens,Homo sapiens,9606,IC50,ug ml-1,UO_0000274,50.0,1
644177,CHEMBL767676,Test inhibition of LTB4 production in human peripheral blood polymorphonuclear leukocytes (HPMN),OCc1cc(-c2ccccc2)c2ccc(OCc3cccc(C4(O)CCOCC4)c3)cc2c1,,,CHEMBL1129067,J Med Chem,1996,CHEMBL128666,,CHEMBL128666,8.05,245890,=,1,1,=,,IC50,nM,9.0,CHEMBL372,Homo sapiens,Homo sapiens,9606,IC50,nM,UO_0000065,9.0,0
943516,CHEMBL821741,In vitro cytotoxicity in Human ovary tumor cells,CC(=O)Oc1cccc2c1-c1nn(-c3ccccc3)c(=O)c3cccc(c13)C2=O,,,CHEMBL1145129,J Med Chem,2003,CHEMBL344926,,CHEMBL344926,,272370,>,1,1,>,,IC50,ug.mL-1,10.0,CHEMBL372,Homo sapiens,Homo sapiens,9606,IC50,ug ml-1,UO_0000274,10.0,0
1209959,CHEMBL871976,Inhibition of LPS/IFN-gamma stimulated TNF-alpha release in human peripheral blood mononuclear cells after 3h of incubation.,C[C@H](Nc1nccc(-c2[nH]c(C3(O)CCN(C)CC3)nc2-c2ccc(F)cc2)n1)c1ccccc1,,,CHEMBL1147483,Bioorg Med Chem Lett,2004,CHEMBL120316,,CHEMBL120316,10.0,227471,=,1,1,=,,IC50,nM,0.1,CHEMBL372,Homo sapiens,Homo sapiens,9606,IC50,uM,UO_0000065,0.0001,0
385913,CHEMBL700564,Compound was evaluated for GROalpha-mediated calcium mobilization in human polymorphonuclear neutrophils(PMNs),N#Cc1c(Cl)ccc(NC(=O)Nc2ccccc2Br)c1O,,,CHEMBL1149089,J Med Chem,2004,CHEMBL26830,,CHEMBL26830,8.12,36908,=,1,1,=,,IC50,nM,7.5,CHEMBL372,Homo sapiens,Homo sapiens,9606,IC50,nM,UO_0000065,7.5,0
32387,CHEMBL763979,Inhibition of human platelet aggregation induced by ADP after 3 min incubation with platelet rich plasma,Cl.Oc1nc2cc3cc(OCCCCc4nnnn4C4CCNCC4)ccc3[nH]c-2n1,,,CHEMBL1126868,J Med Chem,1993,CHEMBL1203045,,CHEMBL110157,8.27,208561,=,1,1,=,,IC50,nM,5.33,CHEMBL372,Homo sapiens,Homo sapiens,9606,IC50,nM,UO_0000065,5.33,0
51932,CHEMBL764816,Inhibitory activity of Ca-ionophore-A23187-induced Leukotriene B4 (LTB4) release in human polymorphonuclear leukocytes,CNC(=O)C(CC1CCCCC1)Nc1nc2cc(C)ccc2o1,,,CHEMBL1127687,J Med Chem,1994,CHEMBL171570,,CHEMBL171570,7.14,341199,=,1,1,=,,IC50,nM,72.0,CHEMBL372,Homo sapiens,Homo sapiens,9606,IC50,uM,UO_0000065,0.072,1
345287,CHEMBL768604,In vitro inhibition of U 46619 induced aggregation of washed platelets,O=C(O)CC(CCCCNS(=O)(=O)c1ccc(Cl)cc1)CCCc1cccnc1,,,CHEMBL1126283,J Med Chem,1992,CHEMBL345105,,CHEMBL345105,6.7,264765,=,1,1,=,,IC50,nM,200.0,CHEMBL372,Homo sapiens,Homo sapiens,9606,IC50,uM,UO_0000065,0.2,1
25035311,CHEMBL5243107,Inhibition of ROS production in human blood,Nc1cccc(OC(=O)c2ccncc2)c1,,,CHEMBL5241111,RSC Med Chem,2022,CHEMBL5288029,,CHEMBL5288029,,3920709,=,1,1,=,,IC50,ug.mL-1,1.42,CHEMBL372,Homo sapiens,Homo sapiens,9606,IC50,ug ml-1,UO_0000274,1.42,0
330188,CHEMBL699152,In vitro inhibition of ADP-induced human platelet aggregation.,CCCCNC(=O)N[C@@H](CNC(=O)c1ccc2c(c1)C(=O)N(CCC1CCNCC1)C2)C(=O)O,,,CHEMBL1129711,Bioorg Med Chem Lett,1996,CHEMBL84774,,CHEMBL84774,7.8,151577,=,1,1,=,,IC50,nM,16.0,CHEMBL372,Homo sapiens,Homo sapiens,9606,IC50,nM,UO_0000065,16.0,0
485902,CHEMBL700876,The compound was tested for the inhibition of platelet aggregation,O=C(NC[C@H](NS(=O)(=O)c1cccnc1)C(=O)O)c1cc2cc(CCC3CCNCC3)sc2s1,,,CHEMBL1151496,Bioorg Med Chem Lett,1997,CHEMBL78760,,CHEMBL78760,8.1,335390,=,1,1,=,,IC50,nM,8.0,CHEMBL372,Homo sapiens,Homo sapiens,9606,IC50,nM,UO_0000065,8.0,0
724507,CHEMBL701818,Inhibition of human mixed lymphocyte response (MLR),CC[C@@H]1/C=C(\C)C[C@H](C)C[C@H](OC)[C@H]2O[C@@](O)(C(=O)C(=O)N3CCCC[C@H]3C(=O)O[C@H](/C(C)=C/C3CC[C@@H](OCC(=O)N(C)Cc4ccccc4)[C@H](OC)C3)[C@H](C)[C@@H](O)CC1=O)[C@H](C)C[C@@H]2OC,,,CHEMBL1131619,J Med Chem,1998,CHEMBL266912,,CHEMBL266912,10.05,83922,=,1,1,=,,IC50,nM,0.09,CHEMBL372,Homo sapiens,Homo sapiens,9606,IC50,nM,UO_0000065,0.09,0
614801,CHEMBL702141,Inhibition of human vascular smooth muscle proliferation was determined,O=C(N[C@@H](CCC(=O)N1CCN(c2cccc(NC3=NCCCN3)c2)CC1)C(=O)O)OCc1ccccc1,,,CHEMBL1146737,Bioorg Med Chem Lett,2004,CHEMBL312929,,CHEMBL312929,8.96,155718,=,1,1,=,,IC50,nM,1.1,CHEMBL372,Homo sapiens,Homo sapiens,9606,IC50,nM,UO_0000065,1.1,0
97288,CHEMBL842875,Inhibition of ADP-induced aggregation of human platelet rich plasma,Cc1ccc(S(=O)(=O)N[C@H]2CC/C(=N\OCc3ccc(C(F)(F)F)cc3)[C@@H]2C/C=C\CCCC(=O)O)cc1,,,CHEMBL1128160,Bioorg Med Chem Lett,1995,CHEMBL20218,,CHEMBL20218,6.75,25188,=,1,1,=,,IC50,nM,180.0,CHEMBL372,Homo sapiens,Homo sapiens,9606,IC50,uM,UO_0000065,0.18,1
709268,CHEMBL841660,Inhibition of IL1-beta release stimulated with LPS in human monocytes,COC(=O)c1cc2c(cc1OC)C=C[C@H]1[C@@](C)(C(=O)OC)CCC[C@]21C,,,CHEMBL1131935,Bioorg Med Chem Lett,1999,CHEMBL341907,,CHEMBL341907,7.0,277859,=,1,1,=,,IC50,nM,100.0,CHEMBL372,Homo sapiens,Homo sapiens,9606,IC50,nM,UO_0000065,100.0,1
1219131,CHEMBL840545,Inhibition of collagen-induced platelet aggregation in human platelet-rich plasma,CCC(NC(=O)c1ccc(C(=N)N)cc1)C(C)(C)C(=O)N1CCC(CC(=O)O)CC1,,,CHEMBL1130999,J Med Chem,1998,CHEMBL77404,,CHEMBL77404,7.07,137836,=,1,1,=,,IC50,nM,85.0,CHEMBL372,Homo sapiens,Homo sapiens,9606,IC50,uM,UO_0000065,0.085,1
428111,CHEMBL768073,Inhibition of 10 uM ADP induced platelet aggregation in human platelet rich citreated plasma (PRP),COc1ccc(C[C@H]2NC(=O)[C@H](CC(=O)O)NC(=O)CNC(=O)[C@H](CCCN=C(N)N)NC(=O)[C@H]3CCCN3C(=O)[C@H](CC(N)=O)NC(=O)[C@H](C)SSC[C@@H](C(N)=O)NC(=O)[C@H](CCCN=C(N)N)NC2=O)cc1,,,CHEMBL1127482,J Med Chem,1994,CHEMBL2371511,,CHEMBL2371511,6.77,327413,=,1,1,=,,IC50,nM,170.0,CHEMBL372,Homo sapiens,Homo sapiens,9606,IC50,uM,UO_0000065,0.17,1
301072,CHEMBL698532,PGI-2 agonistic activity by measuring inhibition of 4 uM ADP-induced human platelet aggregation,O=C(O)COc1cccc2c1CCC(Cn1cc(C(c3ccccc3)c3cccnc3)cn1)C2,,,CHEMBL1150504,Bioorg Med Chem Lett,1995,CHEMBL11779,,CHEMBL11779,6.82,10069,=,1,1,=,,IC50,nM,150.0,CHEMBL372,Homo sapiens,Homo sapiens,9606,IC50,uM,UO_0000065,0.15,1
134414,CHEMBL733698,Inhibition of LPS-stimulated TNF-alpha production in monocyte cells,O=C1NCc2c(-c3ccccc3Cl)cc(OC3CCNCC3)cc2N1c1c(Cl)cccc1Cl,,,CHEMBL1136271,Bioorg Med Chem Lett,2003,CHEMBL94825,,CHEMBL94825,8.8,174908,=,1,1,=,,IC50,nM,1.6,CHEMBL372,Homo sapiens,Homo sapiens,9606,IC50,nM,UO_0000065,1.6,0
1011761,CHEMBL819966,Inhibition of anti-CD3 mAb induced inter leukein-2 production in human whole blood was evaluated,COc1cc(-c2nn([C@H]3CC[C@H](N4CCN(C)CC4)CC3)c3ncnc(N)c23)ccc1NC(=O)c1cc2ccccc2n1C,,,CHEMBL1146742,Bioorg Med Chem Lett,2004,CHEMBL314627,,CHEMBL314627,8.1,159981,=,1,1,=,,IC50,nM,8.0,CHEMBL372,Homo sapiens,Homo sapiens,9606,IC50,uM,UO_0000065,0.008,0
393300,CHEMBL699491,In vitro inhibition of collagen-induced platelet aggregation in human platelet rich plasma,COc1ccc(-c2nc(CC(N)=O)sc2-c2ccc(OC)cc2)cc1,,,CHEMBL1121768,J Med Chem,1981,CHEMBL288265,,CHEMBL288265,,58382,=,1,1,=,,IC50,ug.mL-1,0.0032,CHEMBL372,Homo sapiens,Homo sapiens,9606,IC50,ng ml-1,UO_0000274,3.2,0
1102085,CHEMBL694768,Inhibition of ADP-induced aggregation of human blood platelets in the presence of fibrinogen.,N=C(N)c1ccc(CC(=O)N[C@H]2CCN([C@@H](CC(=O)O)C(=O)N[C@@H](CC34CC5CC(CC(C5)C3)C4)C(=O)O)C2=O)cc1.O=C(O)C(F)(F)F,,,CHEMBL1127009,Bioorg Med Chem Lett,1993,CHEMBL297662,,CHEMBL1183452,7.0,74918,=,1,1,=,,IC50,nM,100.0,CHEMBL372,Homo sapiens,Homo sapiens,9606,IC50,uM,UO_0000065,0.1,1
572087,CHEMBL763989,The compound was tested for their ability to inhibit ADP-stimulated platelet aggregation in human platelet rich plasma,N=C(N)c1ccc(C2=NOC(CC(=O)NC[C@H](NS(=O)(=O)c3ccc(Br)cc3)C(=O)O)C2)cc1.O=C(O)C(F)(F)F,,,CHEMBL1132701,J Med Chem,1999,CHEMBL18391,,CHEMBL1178273,7.29,21805,=,1,1,=,,IC50,nM,51.0,CHEMBL372,Homo sapiens,Homo sapiens,9606,IC50,uM,UO_0000065,0.051,1
402785,CHEMBL768073,Inhibition of 10 uM ADP induced platelet aggregation in human platelet rich citreated plasma (PRP),CC[C@H](C)[C@H]1NC(=O)[C@H](NC(C)=O)CSSC[C@H](C(N)=O)NC(=O)[C@@H](CCCN=C(N)N)NC(=O)[C@H](Cc2ccc(OC)cc2)NC(=O)[C@@H](CC(=O)O)NC(=O)CNC(=O)[C@@H](CCCN=C(N)N)NC(=O)[C@@H]2CCCN2C1=O,,,CHEMBL1127482,J Med Chem,1994,CHEMBL429529,,CHEMBL429529,6.77,327433,=,1,1,=,,IC50,nM,170.0,CHEMBL372,Homo sapiens,Homo sapiens,9606,IC50,uM,UO_0000065,0.17,1
1007937,CHEMBL819966,Inhibition of anti-CD3 mAb induced inter leukein-2 production in human whole blood was evaluated,COc1cc(-c2nn([C@H]3CC[C@H](N4CCN(C)CC4)CC3)c3ncnc(N)c23)ccc1NCc1ccco1,,,CHEMBL1146742,Bioorg Med Chem Lett,2004,CHEMBL431407,,CHEMBL431407,8.0,159982,=,1,1,=,,IC50,nM,10.0,CHEMBL372,Homo sapiens,Homo sapiens,9606,IC50,uM,UO_0000065,0.01,0
814830,CHEMBL700452,Tested for the inhibition of 20-HETE production from arachidonic acid (AA) by human renal microsomes,CCCCc1ccc(/N=C/NO)c(C)c1,,,CHEMBL1133849,Bioorg Med Chem Lett,2001,CHEMBL267865,,CHEMBL267865,8.05,189364,=,1,1,=,,IC50,nM,8.9,CHEMBL372,Homo sapiens,Homo sapiens,9606,IC50,nM,UO_0000065,8.9,0
67308,CHEMBL763979,Inhibition of human platelet aggregation induced by ADP after 3 min incubation with platelet rich plasma,Cl.O=S(=O)(CCCOc1ccc2[nH]c3nc(O)nc-3cc2c1)C1CCN(CCC2CCCCC2)CC1,,,CHEMBL1126868,J Med Chem,1993,CHEMBL1203044,,CHEMBL326644,10.32,208537,=,1,1,=,,IC50,nM,0.048,CHEMBL372,Homo sapiens,Homo sapiens,9606,IC50,nM,UO_0000065,0.048,0
656052,CHEMBL767676,Test inhibition of LTB4 production in human peripheral blood polymorphonuclear leukocytes (HPMN),COc1ccc(-c2c3c(cc4cc(OCc5cccc(C6(O)CCOCC6)c5)ccc24)C(=O)OC3)cc1,,,CHEMBL1129067,J Med Chem,1996,CHEMBL338489,,CHEMBL338489,7.05,245856,=,1,1,=,,IC50,nM,89.0,CHEMBL372,Homo sapiens,Homo sapiens,9606,IC50,nM,UO_0000065,89.0,1
1138345,CHEMBL873206,In vitro inhibitory activity against LTB4 synthesis in A-23187 stimulated human whole blood (HB1).,CO/N=C(\C)c1ccc(Sc2cc(F)cc(C3CCOCC3)c2)cc1,,,CHEMBL1129182,Bioorg Med Chem Lett,1996,CHEMBL282816,,CHEMBL282816,6.96,36582,=,1,1,=,,IC50,nM,110.0,CHEMBL372,Homo sapiens,Homo sapiens,9606,IC50,uM,UO_0000065,0.11,1
1401370,CHEMBL834299,In vitro metabolic stability of compound was tested in human liver microsomes,CCc1cc2cc(C(=O)C[C@H]3CC[C@@H](OC)CC3)ccc2nc1C,,,CHEMBL1144351,J Med Chem,2005,CHEMBL175699,,CHEMBL175699,7.08,360317,=,1,1,=,,IC50,nM,83.0,CHEMBL372,Homo sapiens,Homo sapiens,9606,IC50,nM,UO_0000065,83.0,1
51933,CHEMBL764816,Inhibitory activity of Ca-ionophore-A23187-induced Leukotriene B4 (LTB4) release in human polymorphonuclear leukocytes,CC(=O)Nc1ccc2oc(NC(CC3CCCCC3)c3ccccc3)nc2c1,,,CHEMBL1127687,J Med Chem,1994,CHEMBL170523,,CHEMBL170523,7.11,341205,=,1,1,=,,IC50,nM,78.0,CHEMBL372,Homo sapiens,Homo sapiens,9606,IC50,uM,UO_0000065,0.078,1
827904,CHEMBL856201,In vitro inhibition of LTB4 biosynthesis in Ca++ ionophore activated human polymorphonuclear (HPMN) leukocytes.,CC(COc1ccc2c(c1)c(SC(C)(C)C)c(CC(C)(C)C(=O)O)n2Cc1ccc(Cl)cc1)c1ccccn1,,,CHEMBL1131844,Bioorg Med Chem Lett,1999,CHEMBL80696,,CHEMBL80696,8.4,140790,=,1,1,=,,IC50,nM,4.0,CHEMBL372,Homo sapiens,Homo sapiens,9606,IC50,nM,UO_0000065,4.0,0
1162426,CHEMBL697909,The compound was tested for inhibition of arachidonic acid(800 uM) induced platelet aggregation in human platelet rich plasma.,O=C(O)CCCc1ccccc1CC1C2CCC(O2)C1/C=N/NC(=O)Nc1ccccc1,,,CHEMBL1125886,J Med Chem,1991,CHEMBL95867,,CHEMBL95867,7.92,181729,=,1,1,=,,IC50,nM,12.0,CHEMBL372,Homo sapiens,Homo sapiens,9606,I50,uM,UO_0000065,0.012,0
72248,CHEMBL699531,Concentration required for 50% inhibition of platelet aggregation of human gel-filtered platelets(GFP) in platelet aggregation assay,CCCCS(=O)(=O)N[C@@H](CNC(=O)c1cc2n(n1)CCN(CCC1CCNCC1)C2=O)C(=O)O,,,CHEMBL1130456,Bioorg Med Chem Lett,1997,CHEMBL40502,,CHEMBL40502,8.05,60923,=,1,1,=,,IC50,nM,9.0,CHEMBL372,Homo sapiens,Homo sapiens,9606,IC50,nM,UO_0000065,9.0,0
71112,CHEMBL841606,The compound was evaluated for reduction of ADP-induced human platelet aggregation response by 50% using PRP assay,N=C(N)c1ccc(C(=O)Nc2ccc3c(c2)CCC(CC(=O)O)C3=O)c(F)c1,,,CHEMBL1133397,Bioorg Med Chem Lett,2000,CHEMBL126411,,CHEMBL126411,7.0,242484,=,1,1,=,,IC50,nM,100.0,CHEMBL372,Homo sapiens,Homo sapiens,9606,IC50,uM,UO_0000065,0.1,1
662040,CHEMBL767676,Test inhibition of LTB4 production in human peripheral blood polymorphonuclear leukocytes (HPMN),O=C(O)c1cc(-c2ccccc2)c2ccc(OCc3cccc(C4(O)CCOCC4)c3)cc2c1,,,CHEMBL1129067,J Med Chem,1996,CHEMBL129318,,CHEMBL129318,6.72,245873,=,1,1,=,,IC50,nM,190.0,CHEMBL372,Homo sapiens,Homo sapiens,9606,IC50,nM,UO_0000065,190.0,1
342673,CHEMBL768604,In vitro inhibition of U 46619 induced aggregation of washed platelets,O=C(O)CCC(CCCCNS(=O)(=O)c1ccc(F)cc1)CCCc1cccnc1,,,CHEMBL1126283,J Med Chem,1992,CHEMBL136762,,CHEMBL136762,6.97,264744,=,1,1,=,,IC50,nM,108.0,CHEMBL372,Homo sapiens,Homo sapiens,9606,IC50,uM,UO_0000065,0.108,1
617848,CHEMBL701316,Tested for the inhibition of leukotriene biosynthesis in human whole blood,NC(=O)N(O)C/C=C/c1cccc(Oc2ccccc2)c1,,,CHEMBL1152010,Bioorg Med Chem Lett,1993,CHEMBL105855,,CHEMBL105855,7.05,195304,=,1,1,=,,IC50,nM,90.0,CHEMBL372,Homo sapiens,Homo sapiens,9606,IC50,uM,UO_0000065,0.09,1
1488774,CHEMBL833925,Inhibition of ADP-induced aggregation of human platelets,O=C(O)COc1cccc(C[C@@H]2CCCC3OC32c2nc(-c3ccccc3)c(-c3ccccc3)o2)c1,,,CHEMBL1140242,Bioorg Med Chem Lett,2005,CHEMBL362960,,CHEMBL362960,7.85,386900,=,1,1,=,,IC50,nM,14.0,CHEMBL372,Homo sapiens,Homo sapiens,9606,IC50,nM,UO_0000065,14.0,0
761386,CHEMBL697912,Ability to inhibit platelet aggregation,CCOc1ccc2c(c1)SC1=NS(=O)(=O)C(C(=O)CS(=O)(=O)Nc3nc4ccc(OCC)cc4s3)=C(O)N12,,,CHEMBL1134134,Bioorg Med Chem Lett,2001,CHEMBL540200,,CHEMBL540200,6.75,87322,=,1,1,=,,IC50,nM,180.0,CHEMBL372,Homo sapiens,Homo sapiens,9606,IC50,uM,UO_0000065,0.18,1
264069,CHEMBL695988,Antiproliferative activity was evaluated by the 72 hr MTT cell viability assay using human colon carcinoma cells (GC3).,COc1ccc(C[C@H]2NC(=O)/C=C/C[C@@H]([C@H](C)[C@H]3O[C@@H]3c3ccccc3)OC(=O)[C@H](CC(C)C)OC(=O)C[C@@H](Cc3ccccc3)NC2=O)cc1Cl,,,CHEMBL1131700,Bioorg Med Chem Lett,1999,CHEMBL349357,,CHEMBL349357,8.28,320867,=,1,1,=,,IC50,nM,5.2,CHEMBL372,Homo sapiens,Homo sapiens,9606,IC50,nM,UO_0000065,5.2,0
330191,CHEMBL699152,In vitro inhibition of ADP-induced human platelet aggregation.,O=C(O)c1ccc(S(=O)(=O)N[C@@H](CNC(=O)c2ccc3c(c2)C(=O)N(CCC2CCNCC2)C3)C(=O)O)cc1,,,CHEMBL1129711,Bioorg Med Chem Lett,1996,CHEMBL84259,,CHEMBL84259,8.15,151570,=,1,1,=,,IC50,nM,7.0,CHEMBL372,Homo sapiens,Homo sapiens,9606,IC50,nM,UO_0000065,7.0,0
962936,CHEMBL698017,In vitro evaluation for arachidonic acid induced platelet aggregation of human platelet-rich plasma,C=CCCSCC1C2CCC(O2)C1C/C=C\CCCC(=O)O,,,CHEMBL1124688,J Med Chem,1989,CHEMBL175751,,CHEMBL175751,6.7,348233,=,1,1,=,,IC50,nM,200.0,CHEMBL372,Homo sapiens,Homo sapiens,9606,I50,uM,UO_0000065,0.2,1
1114066,CHEMBL873206,In vitro inhibitory activity against LTB4 synthesis in A-23187 stimulated human whole blood (HB1).,C/C(=N\O)c1ccc(Sc2cc(F)cc(C3CCOCC3)c2)cc1,,,CHEMBL1129182,Bioorg Med Chem Lett,1996,CHEMBL25570,,CHEMBL25570,7.1,36617,=,1,1,=,,IC50,nM,80.0,CHEMBL372,Homo sapiens,Homo sapiens,9606,IC50,uM,UO_0000065,0.08,1
439930,CHEMBL697158,In vitro inhibitory potency against human gel filtered platelet (GFP) aggregation,O=C(O)C[C@H](C#Cc1ccccc1)NC(=O)[C@@H]1CCCN(C(=O)CCC2CCNCC2)C1,,,CHEMBL1132284,J Med Chem,1999,CHEMBL151808,,CHEMBL151808,7.1,292274,=,1,1,=,,IC50,nM,80.0,CHEMBL372,Homo sapiens,Homo sapiens,9606,IC50,uM,UO_0000065,0.08,1
510309,CHEMBL696978,Concentration required to reduce ADP-induced platelet aggregation in platelet rich plasma by 50%.,N=C(N)c1ccc(C(=O)Nc2ccc3c(c2)CCC(CC(=O)O)C3)cc1,,,CHEMBL1132483,J Med Chem,1999,CHEMBL147258,,CHEMBL147258,6.72,282406,=,1,1,=,,IC50,nM,190.0,CHEMBL372,Homo sapiens,Homo sapiens,9606,IC50,uM,UO_0000065,0.19,1
1098192,CHEMBL697868,Inhibitory activity against ATP-stimulated secretion of IL- beta from monocyte-derived human macrophages,O=C([C@H](Cc1ccc(OS(=O)(=O)c2cccc3cnccc23)cc1)NS(=O)(=O)c1cccc2cnccc12)N1CCN(c2ccc(F)cc2)CC1,,,CHEMBL1136752,J Med Chem,2003,CHEMBL282552,,CHEMBL282552,8.6,37564,=,1,1,=,,IC50,nM,2.5,CHEMBL372,Homo sapiens,Homo sapiens,9606,IC50,nM,UO_0000065,2.5,0
117266,CHEMBL765890,Concentration of peptide resulting in 50% inhibition of C5a (100 nM) causing the release of MPO from polymorphonuclear leukocytes,CC(C)[C@H](NC(=O)[C@H](CO)NC(=O)[C@H](Cc1c[nH]cn1)NC(=O)[C@H](CCCCN)NC(=O)[C@H](Cc1ccc(O)cc1)NC(=O)[C@@H](N)CCCCN)C(=O)N[C@H](C(=O)N[C@@H](CCCCN)C(=O)N[C@@H](CCCCN)C(=O)NCCCCC(=O)NCC(=O)NCC(=O)NCC(=O)NCC(=O)N[C@@H](Cc1ccccc1)C(=O)N[C@@H](CCCCN)C(=O)N1CCC[C@H]1C(=O)N[C@H](CC1CCCCC1)C(=O)N[C@@H](Cc1c[nH]c2ccccc12)C(=O)N[C@H](CCCNC(=N)N)C(=O)O)C(C)C,,,CHEMBL1132227,J Med Chem,1999,CHEMBL3350745,,CHEMBL3350745,7.14,103097,=,1,1,=,,IC50,nM,72.44,CHEMBL372,Homo sapiens,Homo sapiens,9606,-Log IC50,,UO_0000065,7.14,1
1202328,CHEMBL702326,Compound was evaluated for in vitro inhibition of leukotriene (LTB4) in human whole blood (HWB),O=c1cc(-c2ccoc2)c2ccc(OCc3cccc(C4(O)CC5COC(C4)O5)n3)cc2n1Cc1ccccc1,,,CHEMBL1131285,Bioorg Med Chem Lett,1998,CHEMBL23007,,CHEMBL23007,6.8,30532,=,1,1,=,,IC50,nM,160.0,CHEMBL372,Homo sapiens,Homo sapiens,9606,IC50,nM,UO_0000065,160.0,1
1001922,CHEMBL701314,Inhibition of LTB4 production from whole human blood.,N#Cc1nccc2c1ncn2CCOc1ccc(Cc2ccccc2)cc1,,,CHEMBL1136655,Bioorg Med Chem Lett,2003,CHEMBL14387,,CHEMBL14387,7.0,15385,=,1,1,=,,IC50,nM,100.0,CHEMBL372,Homo sapiens,Homo sapiens,9606,IC50,uM,UO_0000065,0.1,1
858749,CHEMBL700848,Compound was tested for antitumor activity against human nasopharyngeal carcinoma (KB) by MTT assay on day-3 culture (in vitro),COc1cccc2c1C(=O)C1=C(C2=O)C(O)C2C[C@@](O)(C(=O)CO)C[C@H](OC3CC(N)C(O)C(C)O3)C2C1O.Cl,,,CHEMBL1129548,J Med Chem,1996,CHEMBL555595,,CHEMBL98134,,65310,=,1,1,=,,IC50,ug.mL-1,0.033,CHEMBL372,Homo sapiens,Homo sapiens,9606,IC50,ug ml-1,UO_0000274,0.033,0
