activity_id,assay_chembl_id,assay_description,canonical_smiles,data_validity_comment,data_validity_description,document_chembl_id,document_journal,document_year,molecule_chembl_id,molecule_pref_name,parent_molecule_chembl_id,pchembl_value,record_id,relation,src_id,standard_flag,standard_relation,standard_text_value,standard_type,standard_units,standard_value,target_chembl_id,target_organism,target_pref_name,target_tax_id,type,units,uo_units,value,activity_label
1197737,CHEMBL873099,Concentration which cause half-maximal growth inhibition of human A549 lung carcinoma cell line,CCCCCCCCCCCCCC(=O)O[C@@]12[C@H](OC(C)=O)[C@@H](C)[C@@]3(O)[C@@H](C=C(CO)C[C@]4(C)C(=O)C(C)=C[C@@H]34)[C@@H]1C2(C)C,,,CHEMBL1124395,J Med Chem,1989,CHEMBL344671,,CHEMBL344671,8.7,262670,=,1,1,=,,IC50,nM,2.0,CHEMBL372,Homo sapiens,Homo sapiens,9606,IC50,uM,UO_0000065,0.002,0
1196664,CHEMBL871976,Inhibition of LPS/IFN-gamma stimulated TNF-alpha release in human peripheral blood mononuclear cells after 3h of incubation.,C[C@H](Nc1nccc(-n2c(-c3ccc(F)cc3)nc3nc(N4CCN(C)CC4)ccc32)n1)c1ccccc1,,,CHEMBL1147483,Bioorg Med Chem Lett,2004,CHEMBL119952,,CHEMBL119952,9.0,227462,=,1,1,=,,IC50,nM,1.0,CHEMBL372,Homo sapiens,Homo sapiens,9606,IC50,uM,UO_0000065,0.001,0
53304,CHEMBL763559,Concentration required for maximal in vitro inhibition of aggregation of human platelet rich plasma (hPRP),COc1ccccc1CNC(=N)c1ccc(C2=NO[C@@H](CC(=O)NC[C@H](NS(=O)(=O)c3c(C)noc3C)C(=O)O)C2)cc1,,,CHEMBL1133917,Bioorg Med Chem Lett,2001,CHEMBL304948,,CHEMBL304948,7.26,123892,=,1,1,=,,IC50,nM,55.0,CHEMBL372,Homo sapiens,Homo sapiens,9606,IC50,uM,UO_0000065,0.055,1
279259,CHEMBL698828,Compound was evaluated for the inhibition of CRF-stimulated cyclic adenosine monophosphate production,CCCN(CC1CC1)c1nc(C)nc(Nc2c(Cl)cc(Cl)cc2Cl)c1Cl,,,CHEMBL1129375,J Med Chem,1996,CHEMBL45281,,CHEMBL45281,7.0,263504,=,1,1,=,,IC50,nM,100.0,CHEMBL372,Homo sapiens,Homo sapiens,9606,IC50,nM,UO_0000065,100.0,1
34779,CHEMBL763979,Inhibition of human platelet aggregation induced by ADP after 3 min incubation with platelet rich plasma,CCC(CC)CN1CCC(n2nnnc2CCCOc2ccc3[nH]c4nc(O)nc-4cc3c2)CC1.Cl,,,CHEMBL1126868,J Med Chem,1993,CHEMBL1203039,,CHEMBL111437,10.92,208557,=,1,1,=,,IC50,nM,0.012,CHEMBL372,Homo sapiens,Homo sapiens,9606,IC50,nM,UO_0000065,0.012,0
566742,CHEMBL759885,"Inhibitory activity against platelet aggregation, induced by arachidonic acid in human platelet rich plasma",O=C(O)CCc1ccccc1CC1C2CCC(O2)C1c1nc(C(=O)NC2CCCCC2)co1,,,CHEMBL1126688,J Med Chem,1993,CHEMBL31334,,CHEMBL31334,8.52,47521,=,1,1,=,,IC50,nM,3.0,CHEMBL372,Homo sapiens,Homo sapiens,9606,I50,nM,UO_0000065,3.0,0
589247,CHEMBL763989,The compound was tested for their ability to inhibit ADP-stimulated platelet aggregation in human platelet rich plasma,CCCS(=O)(=O)N[C@@H](CNC(=O)CC1CC(c2ccc(C(=N)N)cc2)=NO1)C(=O)O.O=C(O)C(F)(F)F,,,CHEMBL1132701,J Med Chem,1999,CHEMBL275370,,CHEMBL1183000,7.77,21797,=,1,1,=,,IC50,nM,17.0,CHEMBL372,Homo sapiens,Homo sapiens,9606,IC50,uM,UO_0000065,0.017,0
669788,CHEMBL767676,Test inhibition of LTB4 production in human peripheral blood polymorphonuclear leukocytes (HPMN),CC1OC(=O)c2cc3cc(OCc4cccc(C5(O)CCOCC5)c4)ccc3c(-c3ccccc3)c21,,,CHEMBL1129067,J Med Chem,1996,CHEMBL338549,,CHEMBL338549,6.82,245853,=,1,1,=,,IC50,nM,150.0,CHEMBL372,Homo sapiens,Homo sapiens,9606,IC50,nM,UO_0000065,150.0,1
391883,CHEMBL760709,Ability to block Glycoprotein IIb-IIIa was measured by inhibiting ADP induced human platelet aggregation (5 uM),N=C(N)c1ccc(NC(=O)c2ccc3c(c2)CCN(CC(=O)O)C3=O)cc1,,,CHEMBL1130079,J Med Chem,1997,CHEMBL292795,,CHEMBL292795,7.05,114224,=,1,1,=,,IC50,nM,90.0,CHEMBL372,Homo sapiens,Homo sapiens,9606,IC50,uM,UO_0000065,0.09,1
221451,CHEMBL842872,Compound was tested for its in vitro activity in the inhibition of platelet aggregation using human platelet rich plasma,Cc1cccc(S(=O)(=O)N[C@@H](CNC(=O)C[C@@H]2C[C@H](c3ccc(C(=N)N)cc3)N(C(C)C)O2)C(=O)O)c1.Cl,,,CHEMBL1131698,Bioorg Med Chem Lett,1999,CHEMBL555326,,CHEMBL1195778,6.85,302043,=,1,1,=,,IC50,nM,140.0,CHEMBL372,Homo sapiens,Homo sapiens,9606,IC50,uM,UO_0000065,0.14,1
1024270,CHEMBL702050,Ability to inhibit platelet aggregation of human platelet-rich plasma (PRP) induced by 800 uM of AA-IPA (arachidonic acid),O=C(O)CCC/C=C/CC1C2CCC(O2)C1CNC(=O)CNC(=O)CCCCC1CCCCC1,,,CHEMBL1124904,J Med Chem,1990,CHEMBL312732,,CHEMBL312732,6.8,147466,=,1,1,=,,IC50,nM,160.0,CHEMBL372,Homo sapiens,Homo sapiens,9606,I50,uM,UO_0000065,0.16,1
745833,CHEMBL701818,Inhibition of human mixed lymphocyte response (MLR),CC[C@@H]1/C=C(\C)C[C@H](C)C[C@H](OC)[C@H]2O[C@@](O)(C(=O)C(=O)N3CCCC[C@H]3C(=O)O[C@H](/C(C)=C/C3CC[C@@H](OCC(=O)Nc4cccc(C(F)(F)F)c4)[C@H](OC)C3)[C@H](C)[C@@H](O)CC1=O)[C@H](C)C[C@@H]2OC,,,CHEMBL1131619,J Med Chem,1998,CHEMBL262844,,CHEMBL262844,9.85,83911,=,1,1,=,,IC50,nM,0.14,CHEMBL372,Homo sapiens,Homo sapiens,9606,IC50,nM,UO_0000065,0.14,0
416224,CHEMBL699491,In vitro inhibition of collagen-induced platelet aggregation in human platelet rich plasma,COC(=O)Cc1nc(-c2ccc(OC)cc2)c(-c2ccc(OC)cc2)s1,,,CHEMBL1121768,J Med Chem,1981,CHEMBL37380,,CHEMBL37380,,58392,=,1,1,=,,IC50,ug.mL-1,0.0001,CHEMBL372,Homo sapiens,Homo sapiens,9606,IC50,ng ml-1,UO_0000274,0.1,0
571854,CHEMBL759885,"Inhibitory activity against platelet aggregation, induced by arachidonic acid in human platelet rich plasma",O=C(O)CCc1ccccc1CC1C2CCC(O2)C1c1nc(C(=O)NCCCCCO)co1,,,CHEMBL1126688,J Med Chem,1993,CHEMBL30727,,CHEMBL30727,7.82,47563,=,1,1,=,,IC50,nM,15.0,CHEMBL372,Homo sapiens,Homo sapiens,9606,I50,nM,UO_0000065,15.0,0
1099586,CHEMBL872818,In vitro inhibition of ADP-induced platelet aggregation in human platelet rich plasma.,CCCCC[C@](C)(O)/C=C/C1C(=O)C[C@H](O)[C@@H]1C/C=C\CCCC(=O)O,,,CHEMBL1122225,J Med Chem,1983,CHEMBL355602,,CHEMBL355602,,327324,=,1,1,=,,IC50,ug.mL-1,0.32,CHEMBL372,Homo sapiens,Homo sapiens,9606,IC50,ng ml-1,UO_0000274,320.0,0
553960,CHEMBL763989,The compound was tested for their ability to inhibit ADP-stimulated platelet aggregation in human platelet rich plasma,CS(=O)(=O)O.Cc1noc(C)c1S(=O)(=O)N[C@H](CNC(=O)C[C@@H]1CC(c2ccc(C(=N)N)cc2)=NO1)C(=O)O,,,CHEMBL1132701,J Med Chem,1999,CHEMBL276358,,CHEMBL1183022,6.92,21821,=,1,1,=,,IC50,nM,120.0,CHEMBL372,Homo sapiens,Homo sapiens,9606,IC50,uM,UO_0000065,0.12,1
69963,CHEMBL763979,Inhibition of human platelet aggregation induced by ADP after 3 min incubation with platelet rich plasma,Cl.O=S(=O)(CCCCOc1ccc2[nH]c3nc(O)nc-3cc2c1)C1CCN(Cc2ccccc2)CC1,,,CHEMBL1126868,J Med Chem,1993,CHEMBL1203085,,CHEMBL109740,10.38,208530,=,1,1,=,,IC50,nM,0.042,CHEMBL372,Homo sapiens,Homo sapiens,9606,IC50,nM,UO_0000065,0.042,0
1025476,CHEMBL702050,Ability to inhibit platelet aggregation of human platelet-rich plasma (PRP) induced by 800 uM of AA-IPA (arachidonic acid),CCCCCCCC(=O)NCC(=O)NCC1C2CCC(O2)C1C/C=C/CCCC(=O)O,,,CHEMBL1124904,J Med Chem,1990,CHEMBL81263,,CHEMBL81263,6.75,147452,=,1,1,=,,IC50,nM,180.0,CHEMBL372,Homo sapiens,Homo sapiens,9606,I50,uM,UO_0000065,0.18,1
811125,CHEMBL700452,Tested for the inhibition of 20-HETE production from arachidonic acid (AA) by human renal microsomes,CCc1ccc(N/C=N/O)cc1,,,CHEMBL1133849,Bioorg Med Chem Lett,2001,CHEMBL101296,,CHEMBL101296,8.18,189368,=,1,1,=,,IC50,nM,6.6,CHEMBL372,Homo sapiens,Homo sapiens,9606,IC50,nM,UO_0000065,6.6,0
1084592,CHEMBL768060,Inhibition of ADP-induced platelet aggregation in human platelet rich citreated plasma in presence of 10-20 uM ADP.,CC(=O)NCSC[C@H](NC(=O)CNC(=O)CNC(=O)[C@H]1CSCC(=O)N[C@@H](Cc2ccc(O)cc2)C(=O)N[C@H](CSCCCN)C(=O)NCC(=O)N[C@H](CC(=O)O)C(=O)N1)C(=O)NCC(=O)N[C@@H](CSCNC(C)=O)C(=O)NCC(=O)NCC(=O)N[C@@H](CSN1CC(=O)NCCOCOCCNC(=O)C1)C(N)=O,,,CHEMBL1129533,J Med Chem,1996,CHEMBL265006,,CHEMBL265006,7.16,43603,=,1,1,=,,IC50,nM,70.0,CHEMBL372,Homo sapiens,Homo sapiens,9606,IC50,uM,UO_0000065,0.07,1
613415,CHEMBL702141,Inhibition of human vascular smooth muscle proliferation was determined,Cc1cc(C)c(S(=O)(=O)N[C@@H](CCC(=O)N2CCN(c3cccc(NC4=NCCCN4)c3)CC2)C(=O)O)c(C)c1,,,CHEMBL1146737,Bioorg Med Chem Lett,2004,CHEMBL86094,,CHEMBL86094,,155713,>,1,1,>,,IC50,nM,10.0,CHEMBL372,Homo sapiens,Homo sapiens,9606,IC50,nM,UO_0000065,10.0,0
1132122,CHEMBL761040,Effect on production of LTB4 in human polymorphonuclear leukocytes,CC[C@@H](CSCc1c2c3c(c(OCc4ccc(-c5ccccc5)cn4)ccc3n1Cc1ccc(Cl)cc1)CC(C)S2)C(=O)O,,,CHEMBL1127635,J Med Chem,1994,CHEMBL278632,,CHEMBL278632,8.15,18617,=,1,1,=,,IC50,nM,7.0,CHEMBL372,Homo sapiens,Homo sapiens,9606,IC50,nM,UO_0000065,7.0,0
124185,CHEMBL701920,Inhibition of LPS-induced TNF-alpha production in human whole blood.,CCN(c1ccc(C(Cc2cc[n+]([O-])cc2)c2ccc(OC(F)F)c(OC(F)F)c2)cn1)[C@H](C)c1ccccc1,,,CHEMBL1136601,Bioorg Med Chem Lett,2003,CHEMBL165687,,CHEMBL165687,6.7,321501,=,1,1,=,,IC50,nM,200.0,CHEMBL372,Homo sapiens,Homo sapiens,9606,IC50,uM,UO_0000065,0.2,1
69951,CHEMBL763979,Inhibition of human platelet aggregation induced by ADP after 3 min incubation with platelet rich plasma,COc1ccc(CN2CCN(S(=O)(=O)CCCOc3ccc4[nH]c5nc(O)nc-5cc4c3)CC2)cc1.Cl,,,CHEMBL1126868,J Med Chem,1993,CHEMBL1203077,,CHEMBL324182,9.34,208570,=,1,1,=,,IC50,nM,0.46,CHEMBL372,Homo sapiens,Homo sapiens,9606,IC50,nM,UO_0000065,0.46,0
646505,CHEMBL767676,Test inhibition of LTB4 production in human peripheral blood polymorphonuclear leukocytes (HPMN),O=C1OCc2c1cc1cc(OCc3cccc(C4(O)CCOCC4)c3)ccc1c2-c1ccoc1,,,CHEMBL1129067,J Med Chem,1996,CHEMBL129018,,CHEMBL129018,8.7,245877,=,1,1,=,,IC50,nM,2.0,CHEMBL372,Homo sapiens,Homo sapiens,9606,IC50,nM,UO_0000065,2.0,0
69958,CHEMBL763979,Inhibition of human platelet aggregation induced by ADP after 3 min incubation with platelet rich plasma,Cl.Oc1nc2cc3cc(OCCCc4nnnn4C4CCN(CC5CCCCC5)CC4)ccc3[nH]c-2n1,,,CHEMBL1126868,J Med Chem,1993,CHEMBL1203053,,CHEMBL109958,10.8,208548,=,1,1,=,,IC50,nM,0.016,CHEMBL372,Homo sapiens,Homo sapiens,9606,IC50,nM,UO_0000065,0.016,0
583920,CHEMBL878710,Tested for Concentration required for the inhibition of ADP-induced aggregation of human platelets,CC#CCC(C)[C@H](O)/C=C/[C@H]1[C@H](O)CC2Oc3c(CCCC(=O)[O-])cccc3[C@@H]21.[Na+],,,CHEMBL1132727,Bioorg Med Chem Lett,2000,CHEMBL94694,,CHEMBL1205415,8.37,174246,=,1,1,=,,IC50,nM,4.3,CHEMBL372,Homo sapiens,Homo sapiens,9606,IC50,nM,UO_0000065,4.3,0
60840,CHEMBL763979,Inhibition of human platelet aggregation induced by ADP after 3 min incubation with platelet rich plasma,Cl.O=C(NCCCOc1ccc2[nH]c3nc(O)nc-3cc2c1)N1CCN(CC2CCCC2)CC1,,,CHEMBL1126868,J Med Chem,1993,CHEMBL1203020,,CHEMBL110162,10.03,208534,=,1,1,=,,IC50,nM,0.094,CHEMBL372,Homo sapiens,Homo sapiens,9606,IC50,nM,UO_0000065,0.094,0
1403925,CHEMBL834790,Inhibitory concentration against gel filtered platelet aggregation induced by alpha thrombin,CN[C@H](Cc1ccccc1)C(=O)N1CCCC[C@H]1C(=O)NC(CCCN=C(N)N)C(=O)c1nc2ccccc2s1,,,CHEMBL1142732,J Med Chem,2005,CHEMBL361822,,CHEMBL361822,8.0,361084,=,1,1,=,,IC50,nM,10.0,CHEMBL372,Homo sapiens,Homo sapiens,9606,IC50,nM,UO_0000065,10.0,0
748393,CHEMBL701818,Inhibition of human mixed lymphocyte response (MLR),CC[C@@H]1/C=C(\C)C[C@H](C)C[C@H](OC)[C@H]2O[C@@](O)(C(=O)C(=O)N3CCCC[C@H]3C(=O)O[C@H](/C(C)=C/C3CC[C@@H](OCC(=O)Nc4ccc(N5CCOCC5)cc4)[C@H](OC)C3)[C@H](C)[C@@H](O)CC1=O)[C@H](C)C[C@@H]2OC,,,CHEMBL1131619,J Med Chem,1998,CHEMBL385686,,CHEMBL385686,9.24,83906,=,1,1,=,,IC50,nM,0.58,CHEMBL372,Homo sapiens,Homo sapiens,9606,IC50,nM,UO_0000065,0.58,0
989746,CHEMBL701986,Compound was evaluated for inhibition of Interleukin (IL1-beta) release in human monocytes.,CC(=O)Oc1cc2c(c(C)c1OC(C)=O)[C@H]1CC[C@]3(C)[C@@H](OC(C)=O)CC[C@H]3[C@@H]1C=C2,,,CHEMBL1130623,Bioorg Med Chem Lett,1998,CHEMBL328500,,CHEMBL328500,6.82,177136,=,1,1,=,,IC50,nM,150.0,CHEMBL372,Homo sapiens,Homo sapiens,9606,IC50,nM,UO_0000065,150.0,1
621119,CHEMBL702141,Inhibition of human vascular smooth muscle proliferation was determined,O=C(Cc1ccccc1)N[C@@H](CCC(=O)N1CCN(c2cccc(NC3=NCCCN3)c2)CC1)C(=O)O,,,CHEMBL1146737,Bioorg Med Chem Lett,2004,CHEMBL85196,,CHEMBL85196,,155712,>,1,1,>,,IC50,nM,10.0,CHEMBL372,Homo sapiens,Homo sapiens,9606,IC50,nM,UO_0000065,10.0,0
815462,CHEMBL822590,Inhibition of cellular growth was evaluated in vitro against human colon carcinoma LOVO.,O=C1c2ccccc2C(=O)c2c(NCCNCCO)ccc(NCCNCCO)c21,,,CHEMBL1125604,J Med Chem,1991,CHEMBL49442,AMETANTRONE,CHEMBL49442,,139570,=,1,1,=,,IC50,ug.mL-1,0.2825,CHEMBL372,Homo sapiens,Homo sapiens,9606,IC50,ng ml-1,UO_0000274,282.5,0
1401508,CHEMBL834299,In vitro metabolic stability of compound was tested in human liver microsomes,CCc1cc2cc(C(=O)[C@H]3CC[C@@H](OC)CC3)ccc2n2nnnc12,,,CHEMBL1144351,J Med Chem,2005,CHEMBL176068,,CHEMBL176068,7.17,360298,=,1,1,=,,IC50,nM,68.0,CHEMBL372,Homo sapiens,Homo sapiens,9606,IC50,nM,UO_0000065,68.0,1
401252,CHEMBL761736,Evaluated for human platelet aggregation.,O=C(O)[C@H](CCC(=O)N1CCC(CCCC2CCNCC2)CC1)NS(=O)(=O)c1cccc2ccccc12,,,CHEMBL1129099,Bioorg Med Chem Lett,1996,CHEMBL32626,,CHEMBL32626,8.0,46519,=,1,1,=,,IC50,nM,10.0,CHEMBL372,Homo sapiens,Homo sapiens,9606,IC50,uM,UO_0000065,0.01,0
943511,CHEMBL821741,In vitro cytotoxicity in Human ovary tumor cells,O=[N+]([O-])c1ccc(NN=C(c2ccccc2O)c2ccccc2O)c([N+](=O)[O-])c1,,,CHEMBL1145129,J Med Chem,2003,CHEMBL344612,,CHEMBL344612,,272357,=,1,1,=,,IC50,ug.mL-1,5.0,CHEMBL372,Homo sapiens,Homo sapiens,9606,IC50,ug ml-1,UO_0000274,5.0,0
464579,CHEMBL701319,Inhibition of leukotriene B4 production in human whole blood,CN(CCCOc1ccc(Cc2ccccc2)cc1)CCC(=O)O,,,CHEMBL1134981,Bioorg Med Chem Lett,2002,CHEMBL112671,,CHEMBL112671,7.31,215636,=,1,1,=,,IC50,nM,49.0,CHEMBL372,Homo sapiens,Homo sapiens,9606,IC50,uM,UO_0000065,0.049,1
949270,CHEMBL702339,In vitro inhibition of platelet aggregation by measuring its effect on the ADP-stimulated aggregation of human platelets,CCCCS(=O)(=O)NC(CC#Cc1ccc2c(c1)c(=O)n(CCC1CCNCC1)c(=O)n2C)C(=O)O,,,CHEMBL1130763,Bioorg Med Chem Lett,1998,CHEMBL144573,,CHEMBL144573,7.17,281677,=,1,1,=,,IC50,nM,67.0,CHEMBL372,Homo sapiens,Homo sapiens,9606,IC50,uM,UO_0000065,0.067,1
594823,CHEMBL729970,Inhibition of VEGF-stimulated migration of human microvascular endothelial cells,NCCCCCC(=O)Nc1ccc(C(=O)O)c(-c2ccc(O)cc2)c1,,,CHEMBL1146719,Bioorg Med Chem Lett,2004,CHEMBL173266,,CHEMBL173266,10.22,346356,=,1,1,=,,IC50,nM,0.06,CHEMBL372,Homo sapiens,Homo sapiens,9606,IC50,nM,UO_0000065,0.06,0
615060,CHEMBL824150,Compound was tested in vitro for inhibitory activity against human FKBP,CC[C@@H]1/C=C(\C)C[C@H](C)C[C@H](OC)[C@H]2O[C@@](O)(C(=O)C(=O)N3CCCC[C@H]3C(=O)O[C@H](/C(C)=C/[C@@H]3CC[C@@H](O)[C@H](OC)C3)[C@H](C)[C@@H](O)CC1=O)[C@H](C)C[C@@H]2OC,,,CHEMBL1130792,Bioorg Med Chem Lett,1998,CHEMBL8597,ASCOMYCIN,CHEMBL8597,8.69,342761,=,1,1,=,,IC50,nM,2.06,CHEMBL372,Homo sapiens,Homo sapiens,9606,IC50,nM,UO_0000065,2.06,0
330904,CHEMBL764818,Inhibitory activity against production of leukotriene B4 in isolated human polymorphonuclear leukocytes,OCc1ccccc1CCCc1cc2c(cc1O)CCO2,,,CHEMBL1124721,J Med Chem,1990,CHEMBL170484,,CHEMBL170484,6.72,340572,=,1,1,=,,IC50,nM,190.0,CHEMBL372,Homo sapiens,Homo sapiens,9606,IC50,nM,UO_0000065,190.0,1
622405,CHEMBL702141,Inhibition of human vascular smooth muscle proliferation was determined,O=C(N[C@@H](CCC(=O)N1CCN(c2cccc(NC3=NCC(F)CN3)c2)CC1)C(=O)O)OCc1ccccc1,,,CHEMBL1146737,Bioorg Med Chem Lett,2004,CHEMBL84578,,CHEMBL84578,9.59,155722,=,1,1,=,,IC50,nM,0.26,CHEMBL372,Homo sapiens,Homo sapiens,9606,IC50,nM,UO_0000065,0.26,0
557636,CHEMBL763989,The compound was tested for their ability to inhibit ADP-stimulated platelet aggregation in human platelet rich plasma,N=C(N)c1ccc(C2=NOC(CC(=O)NC[C@H](NS(=O)(=O)c3cccc4ccccc34)C(=O)O)C2)cc1.O=C(O)C(F)(F)F,,,CHEMBL1132701,J Med Chem,1999,CHEMBL18323,,CHEMBL1178271,7.26,21804,=,1,1,=,,IC50,nM,55.0,CHEMBL372,Homo sapiens,Homo sapiens,9606,IC50,uM,UO_0000065,0.055,1
825745,CHEMBL701437,Inhibition of calcium ionophore (A-23187) stimulated leukotriene B4 (LTB4) formation in human neutrophils at 390 nM,O=C(O)CON=C1CCC(c2ccc(OCc3ccc4ccccc4n3)cc2)(c2ccc(OCc3ccc4ccccc4n3)cc2)CC1,,,CHEMBL1133442,J Med Chem,2000,CHEMBL112113,,CHEMBL112113,7.19,212786,=,1,1,=,,IC50,nM,65.0,CHEMBL372,Homo sapiens,Homo sapiens,9606,IC50,nM,UO_0000065,65.0,1
459472,CHEMBL699333,Inhibition of cellular cholesterol biosynthesis using human fibroblasts in tissue culture,Nc1ccc(SC[C@@H]2CO[C@](CCc3ccc(Cl)cc3)(Cn3ccnc3)O2)cc1,,,CHEMBL1127068,J Med Chem,1993,CHEMBL70611,AZALANSTAT,CHEMBL70611,10.05,127176,=,1,1,=,,IC50,nM,0.09,CHEMBL372,Homo sapiens,Homo sapiens,9606,IC50,nM,UO_0000065,0.09,0
636851,CHEMBL699196,Concentration inhibiting 50% of the copper induced lipid peroxidation determined using the thiobarbituric acid reactive substance and expressed as an MDA equivalent,CCCCN(C(=O)C1=COc2cc(O)c(C(C)(C)C)cc2O1)c1ccccc1,,,CHEMBL1134682,J Med Chem,2001,CHEMBL339617,,CHEMBL339617,6.7,243427,=,1,1,=,,IC50,nM,200.0,CHEMBL372,Homo sapiens,Homo sapiens,9606,IC50,M,UO_0000065,2e-07,1
662038,CHEMBL767676,Test inhibition of LTB4 production in human peripheral blood polymorphonuclear leukocytes (HPMN),CC1CC(O)(c2cccc(COc3ccc4c(-c5ccccc5)c5c(cc4c3)C(=O)OC5)c2)CC(C)O1,,,CHEMBL1129067,J Med Chem,1996,CHEMBL128751,,CHEMBL128751,8.52,245851,=,1,1,=,,IC50,nM,3.0,CHEMBL372,Homo sapiens,Homo sapiens,9606,IC50,nM,UO_0000065,3.0,0
954886,CHEMBL761041,In vitro inhibition of LTB4 formation in human peripheral blood polymorphonuclear leukocytes (HPMN),COC1(c2cccc(COc3ccc4ccccc4c3)c2)CCOCC1,,,CHEMBL1127834,J Med Chem,1994,CHEMBL149839,,CHEMBL149839,7.26,290289,=,1,1,=,,IC50,nM,55.0,CHEMBL372,Homo sapiens,Homo sapiens,9606,IC50,nM,UO_0000065,55.0,1
49445,CHEMBL763979,Inhibition of human platelet aggregation induced by ADP after 3 min incubation with platelet rich plasma,Cl.O=S(=O)(CCCOc1ccc2[nH]c3nc(O)nc-3cc2c1)C1CCN(Cc2ccccc2)CC1,,,CHEMBL1126868,J Med Chem,1993,CHEMBL1203032,,CHEMBL324216,10.6,208543,=,1,1,=,,IC50,nM,0.025,CHEMBL372,Homo sapiens,Homo sapiens,9606,IC50,nM,UO_0000065,0.025,0
349735,CHEMBL841401,Inhibitory activity against LPS-stimulated IL-1 beta release from human monocytes,CC(=O)Oc1cc2c(cc1OC(C)=O)[C@]1(C)CC[C@H]3C(C)(C)C(=O)CC[C@]3(C)C1=CC2,,,CHEMBL1130726,Bioorg Med Chem Lett,1998,CHEMBL121213,,CHEMBL121213,6.85,230953,=,1,1,=,,IC50,nM,140.0,CHEMBL372,Homo sapiens,Homo sapiens,9606,IC50,nM,UO_0000065,140.0,1
652423,CHEMBL767676,Test inhibition of LTB4 production in human peripheral blood polymorphonuclear leukocytes (HPMN),Cn1nnc(-c2cc(-c3ccccc3)c3ccc(OCc4cccc(C5(O)CCOCC5)c4)cc3c2)n1,,,CHEMBL1129067,J Med Chem,1996,CHEMBL129167,,CHEMBL129167,8.4,245848,=,1,1,=,,IC50,nM,4.0,CHEMBL372,Homo sapiens,Homo sapiens,9606,IC50,nM,UO_0000065,4.0,0
936968,CHEMBL821741,In vitro cytotoxicity in Human ovary tumor cells,O=[N+]([O-])c1ccc(N(Cc2ccccc2)N=c2c3ccccc3oc3ccccc23)c([N+](=O)[O-])c1,,,CHEMBL1145129,J Med Chem,2003,CHEMBL140156,,CHEMBL140156,,272373,>,1,1,>,,IC50,ug.mL-1,10.0,CHEMBL372,Homo sapiens,Homo sapiens,9606,IC50,ug ml-1,UO_0000274,10.0,0
570605,CHEMBL759885,"Inhibitory activity against platelet aggregation, induced by arachidonic acid in human platelet rich plasma",CC(C)NC(=O)c1coc(C2C3CCC(O3)C2Cc2ccccc2CCC(=O)O)n1,,,CHEMBL1126688,J Med Chem,1993,CHEMBL29947,,CHEMBL29947,8.15,47525,=,1,1,=,,IC50,nM,7.0,CHEMBL372,Homo sapiens,Homo sapiens,9606,I50,nM,UO_0000065,7.0,0
375251,CHEMBL700001,Compound is evaluated for inhibitory effect on the generation of Leukotriene B4 (LTB4) from human neutrophils,CCN1CC/C(=C\c2cc(C(C)(C)C)c(O)c(C(C)(C)C)c2)C1=O,,,CHEMBL1123637,J Med Chem,1987,CHEMBL432337,,CHEMBL432337,6.82,104867,=,1,1,=,,IC50,nM,150.0,CHEMBL372,Homo sapiens,Homo sapiens,9606,IC50,M,UO_0000065,1.5e-07,1
865471,CHEMBL698016,Compound was evaluated for the ability to inhibit arachidonic acid induced platelet aggregation (AAIPA) in human platelet rich plasma,O=C(O)CCc1ccccc1CC1C2CCC(O2)C1/C=N/NC(=O)Nc1ccccc1,,,CHEMBL1126002,Bioorg Med Chem Lett,1991,CHEMBL95872,,CHEMBL95872,8.52,274976,=,1,1,=,,IC50,nM,3.0,CHEMBL372,Homo sapiens,Homo sapiens,9606,I50,nM,UO_0000065,3.0,0
250545,CHEMBL695988,Antiproliferative activity was evaluated by the 72 hr MTT cell viability assay using human colon carcinoma cells (GC3).,COc1ccc(C[C@H]2NC(=O)/C=C/C[C@@H]([C@H](C)[C@H]3O[C@@H]3c3ccccc3)OC(=O)[C@H](CC(C)C)OC(=O)C[C@@H](c3ccccc3)NC2=O)cc1Cl,,,CHEMBL1131700,Bioorg Med Chem Lett,1999,CHEMBL351974,,CHEMBL351974,9.03,320868,=,1,1,=,,IC50,nM,0.94,CHEMBL372,Homo sapiens,Homo sapiens,9606,IC50,nM,UO_0000065,0.94,0
1088310,CHEMBL697025,Concentration to achieve half-maximal inhibition of acid-induced swelling in human platelets using platelet swelling assay,CC(C)c1ccc(C(=O)N=C(N)N)cc1S(C)(=O)=O,,,CHEMBL1131104,J Med Chem,1998,CHEMBL436559,CARIPORIDE,CHEMBL436559,6.93,234847,=,1,1,=,,IC50,nM,117.0,CHEMBL372,Homo sapiens,Homo sapiens,9606,IC50,nM,UO_0000065,117.0,1
864189,CHEMBL856201,In vitro inhibition of LTB4 biosynthesis in Ca++ ionophore activated human polymorphonuclear (HPMN) leukocytes.,COc1ccc2nc(COc3ccc4c(c3)c(SC(C)(C)C)c(CC(C)(C)C(=O)O)n4Cc3ccc(Cl)cc3)sc2c1,,,CHEMBL1131844,Bioorg Med Chem Lett,1999,CHEMBL311968,,CHEMBL311968,8.1,140798,=,1,1,=,,IC50,nM,8.0,CHEMBL372,Homo sapiens,Homo sapiens,9606,IC50,nM,UO_0000065,8.0,0
1081112,CHEMBL768060,Inhibition of ADP-induced platelet aggregation in human platelet rich citreated plasma in presence of 10-20 uM ADP.,N=C(N)c1ccc(C[C@H]2NC(=O)[C@H](Cc3ccc(O)cc3)NC(=O)CSC[C@H](C(=O)NCC(=O)NCC(=O)N[C@@H](CS)C(=O)NCC(=O)N[C@@H](CS)C(=O)NCC(=O)NCC(=O)N[C@@H](CSCC(=O)CC(=O)N[C@@H](CCCCN)C(=O)N[C@@H](CCCCN)C(=O)NCC(=O)N[C@@H](CS)C(=O)O)C(N)=O)NC(=O)[C@@H](CC(=O)O)NC(=O)CNC2=O)cc1,,,CHEMBL1129533,J Med Chem,1996,CHEMBL408986,,CHEMBL408986,7.3,43597,=,1,1,=,,IC50,nM,50.0,CHEMBL372,Homo sapiens,Homo sapiens,9606,IC50,uM,UO_0000065,0.05,1
1401499,CHEMBL834299,In vitro metabolic stability of compound was tested in human liver microsomes,CO[C@H]1CC[C@@H](C(=O)c2ccc3nc4c(cc3c2)CCS4)CC1,,,CHEMBL1144351,J Med Chem,2005,CHEMBL175463,,CHEMBL175463,7.11,360284,=,1,1,=,,IC50,nM,78.0,CHEMBL372,Homo sapiens,Homo sapiens,9606,IC50,nM,UO_0000065,78.0,1
42043,CHEMBL764816,Inhibitory activity of Ca-ionophore-A23187-induced Leukotriene B4 (LTB4) release in human polymorphonuclear leukocytes,Clc1ccc2oc(NC(CN3CCSCC3)c3ccccc3)nc2c1,,,CHEMBL1127687,J Med Chem,1994,CHEMBL173238,,CHEMBL173238,7.32,341227,=,1,1,=,,IC50,nM,48.0,CHEMBL372,Homo sapiens,Homo sapiens,9606,IC50,uM,UO_0000065,0.048,1
589095,CHEMBL759885,"Inhibitory activity against platelet aggregation, induced by arachidonic acid in human platelet rich plasma",CC(C)(C)CCNC(=O)c1coc(C2C3CCC(O3)C2Cc2ccccc2CCC(=O)O)n1,,,CHEMBL1126688,J Med Chem,1993,CHEMBL31850,,CHEMBL31850,8.1,47523,=,1,1,=,,IC50,nM,8.0,CHEMBL372,Homo sapiens,Homo sapiens,9606,I50,nM,UO_0000065,8.0,0
1215205,CHEMBL871976,Inhibition of LPS/IFN-gamma stimulated TNF-alpha release in human peripheral blood mononuclear cells after 3h of incubation.,Fc1ccc(-c2nc(C3CCNCC3)cn2-c2ccnc(NC3CCCCC3)n2)cc1,,,CHEMBL1147483,Bioorg Med Chem Lett,2004,CHEMBL415712,,CHEMBL415712,9.1,227464,=,1,1,=,,IC50,nM,0.8,CHEMBL372,Homo sapiens,Homo sapiens,9606,IC50,uM,UO_0000065,0.0008,0
854861,CHEMBL856201,In vitro inhibition of LTB4 biosynthesis in Ca++ ionophore activated human polymorphonuclear (HPMN) leukocytes.,CC(C)(C)Sc1c(CC(C)(C)C(=O)O)n(Cc2ccc(Cl)cc2)c2ccc(OCc3ccccn3)cc12,,,CHEMBL1131844,Bioorg Med Chem Lett,1999,CHEMBL38958,,CHEMBL38958,8.7,140795,=,1,1,=,,IC50,nM,2.0,CHEMBL372,Homo sapiens,Homo sapiens,9606,IC50,nM,UO_0000065,2.0,0
1085197,CHEMBL697861,"In vitro cytotoxic activity against, human lymphoblastic leukemia cell culture (CCRF-CEM)",COc1cc2c(cc1C[N+](C)(C)CSc1ccccc1)-c1ccccc1CC2.[Br-],,,CHEMBL1122829,J Med Chem,1985,CHEMBL38640,,CHEMBL1178724,,61855,=,1,1,=,,IC50,ug.mL-1,1.4,CHEMBL372,Homo sapiens,Homo sapiens,9606,IC50,ug ml-1,UO_0000274,1.4,0
914070,CHEMBL695826,Inhibitory activity against human concanavalin-A proliferation assay,COC(=O)N(O)[C@H]1C[C@@H]2CC[C@@H](C)[C@@](O)(O2)C(=O)C(=O)N2CCCC[C@H]2C(=O)O[C@H]([C@H](C)C[C@@H]2CC[C@@H](O)[C@H](OC)C2)CC(=O)[C@H](C)/C=C(\C)[C@@H](O)[C@@H](OC)C(=O)[C@H](C)C[C@H](C)/C=C/C=C/C=C/1C,,,CHEMBL1133206,Bioorg Med Chem Lett,2000,CHEMBL411958,,CHEMBL411958,8.83,46572,=,1,1,=,,IC50,nM,1.47,CHEMBL372,Homo sapiens,Homo sapiens,9606,IC50,nM,UO_0000065,1.47,0
581503,CHEMBL759885,"Inhibitory activity against platelet aggregation, induced by arachidonic acid in human platelet rich plasma",CCCCCN(C)C(=O)c1coc(C2C3CCC(O3)C2Cc2ccccc2CCC(=O)O)n1,,,CHEMBL1126688,J Med Chem,1993,CHEMBL418583,,CHEMBL418583,8.05,47560,=,1,1,=,,IC50,nM,9.0,CHEMBL372,Homo sapiens,Homo sapiens,9606,I50,nM,UO_0000065,9.0,0
54418,CHEMBL763559,Concentration required for maximal in vitro inhibition of aggregation of human platelet rich plasma (hPRP),N=C(N)c1ccc(C2=NO[C@@H](CC(=O)NCCC(=O)O)C2)cc1,,,CHEMBL1133917,Bioorg Med Chem Lett,2001,CHEMBL129766,,CHEMBL129766,7.22,123880,=,1,1,=,,IC50,nM,60.0,CHEMBL372,Homo sapiens,Homo sapiens,9606,IC50,uM,UO_0000065,0.06,1
1136092,CHEMBL761040,Effect on production of LTB4 in human polymorphonuclear leukocytes,CC1Cc2c(OCc3ccc(-c4ccccc4)cn3)ccc3c2c(c(CCSC(C)C(=O)O)n3Cc2ccc(Cl)cc2)S1,,,CHEMBL1127635,J Med Chem,1994,CHEMBL16389,,CHEMBL16389,7.77,18623,=,1,1,=,,IC50,nM,17.0,CHEMBL372,Homo sapiens,Homo sapiens,9606,IC50,nM,UO_0000065,17.0,0
138205,CHEMBL702523,Anti-platelet activity was measured by studying their antagonist effects on human platelets aggregated with collagen,O=C(O)CCn1c2c(c3ccccc31)C[C@H](NS(=O)(=O)c1ccc(F)cc1)CC2,,,CHEMBL1136030,Bioorg Med Chem Lett,2002,CHEMBL361812,RAMATROBAN,CHEMBL361812,7.3,150727,=,1,1,=,,IC50,nM,50.0,CHEMBL372,Homo sapiens,Homo sapiens,9606,IC50,uM,UO_0000065,0.05,1
1088414,CHEMBL872818,In vitro inhibition of ADP-induced platelet aggregation in human platelet rich plasma.,CCCCC[C@@H]1/C=C\C2C(=O)CC(O)[C@@H]2C/C=C\CCCC(=O)O1,,,CHEMBL1122225,J Med Chem,1983,CHEMBL276380,,CHEMBL276380,,327319,=,1,1,=,,IC50,ug.mL-1,1.0,CHEMBL372,Homo sapiens,Homo sapiens,9606,IC50,ng ml-1,UO_0000274,1000.0,0
