activity_id,assay_chembl_id,assay_description,canonical_smiles,data_validity_comment,data_validity_description,document_chembl_id,document_journal,document_year,molecule_chembl_id,molecule_pref_name,parent_molecule_chembl_id,pchembl_value,record_id,relation,src_id,standard_flag,standard_relation,standard_text_value,standard_type,standard_units,standard_value,target_chembl_id,target_organism,target_pref_name,target_tax_id,type,units,uo_units,value,activity_label
440913,CHEMBL841662,Inhibition of TNF alpha synthesis in human monocytes,COc1ccc2c(Cc3c(Cl)cncc3Cl)n[n+]([O-])cc2c1OC1CCCC1,,,CHEMBL1132750,Bioorg Med Chem Lett,2000,CHEMBL72362,,CHEMBL72362,6.86,127283,=,1,1,=,,IC50,nM,139.0,CHEMBL372,Homo sapiens,Homo sapiens,9606,IC50,nM,UO_0000065,139.0,1
627438,CHEMBL702141,Inhibition of human vascular smooth muscle proliferation was determined,CCOC(=O)N[C@@H](CCC(=O)N1CCN(c2cccc(NC3=NCCCN3)c2)CC1)C(=O)O,,,CHEMBL1146737,Bioorg Med Chem Lett,2004,CHEMBL84911,,CHEMBL84911,8.68,155721,=,1,1,=,,IC50,nM,2.1,CHEMBL372,Homo sapiens,Homo sapiens,9606,IC50,nM,UO_0000065,2.1,0
1272194,CHEMBL842873,In vitro inhibition of 5.86 uM ADP-induced human platelet aggregation in platelet rich plasma (PRP),O=C(O)COc1cccc(-c2ncoc2-c2nc(-c3ccccc3)c(-c3ccccc3)o2)c1,,,CHEMBL1126926,J Med Chem,1993,CHEMBL419780,,CHEMBL419780,6.8,242924,=,1,1,=,,IC50,nM,160.0,CHEMBL372,Homo sapiens,Homo sapiens,9606,IC50,uM,UO_0000065,0.16,1
129655,CHEMBL698041,Compound was tested in vitro for inhibitory activity in LTB4 induced Ca mobilization,COc1ccc(CCCCCCCCOc2ccc(CSCc3cccc(C(=O)O)c3)nc2/C=C/C(=O)O)cc1,,,CHEMBL1129361,J Med Chem,1996,CHEMBL422598,,CHEMBL422598,6.88,162527,=,1,1,=,,IC50,nM,131.0,CHEMBL372,Homo sapiens,Homo sapiens,9606,IC50,nM,UO_0000065,131.0,1
393559,CHEMBL699801,Inhibitory concentration by calcium flux assay,Sc1nc(-c2ccccc2Cl)nn1Cc1cccc(Cl)c1,,,CHEMBL1136144,Bioorg Med Chem Lett,2003,CHEMBL309253,,CHEMBL309253,,152028,<,1,1,<,,IC50,nM,48.0,CHEMBL372,Homo sapiens,Homo sapiens,9606,IC50,uM,UO_0000065,0.048,1
1118531,CHEMBL878772,Compound was evaluated for production of leukotriene B4 in Ca+2 -ionophore -activated human polymorphonuclear (HPMN) leukocytes.,N#Cc1cc(-c2ccoc2)c2ccc(OCc3cncc(C4(O)CCOCC4)c3)cc2c1,,,CHEMBL1130137,J Med Chem,1997,CHEMBL316641,,CHEMBL316641,8.0,180615,=,1,1,=,,IC50,nM,10.0,CHEMBL372,Homo sapiens,Homo sapiens,9606,IC50,nM,UO_0000065,10.0,0
636683,CHEMBL767676,Test inhibition of LTB4 production in human peripheral blood polymorphonuclear leukocytes (HPMN),COC(=O)c1cc(Cc2ccccc2)c2ccc(OCc3cccc(C4(O)CCOCC4)c3)cc2c1,,,CHEMBL1129067,J Med Chem,1996,CHEMBL129111,,CHEMBL129111,,245861,>,1,1,>,,IC50,nM,70.0,CHEMBL372,Homo sapiens,Homo sapiens,9606,IC50,nM,UO_0000065,70.0,1
493509,CHEMBL701913,Concentration required to reduce ADP-induced platelet aggregation in platelet rich plasma by 50%,N=C(N)c1ccc(C(=O)Nc2ccc3c(c2)CCN(CC(=O)O)C3)cc1,,,CHEMBL1132483,J Med Chem,1999,CHEMBL148205,,CHEMBL148205,6.77,282408,=,1,1,=,,IC50,nM,170.0,CHEMBL372,Homo sapiens,Homo sapiens,9606,IC50,uM,UO_0000065,0.17,1
127012,CHEMBL701928,Inhibition of LPS-stimulated TNF-alpha production in human whole blood,CC(C)N1CCC(c2cc(-c3ccc(F)cc3Cl)c3c(c2)N(c2c(Cl)cccc2Cl)C(=O)NC3)CC1,,,CHEMBL1136271,Bioorg Med Chem Lett,2003,CHEMBL328242,,CHEMBL328242,8.25,174917,=,1,1,=,,IC50,nM,5.6,CHEMBL372,Homo sapiens,Homo sapiens,9606,IC50,nM,UO_0000065,5.6,0
625091,CHEMBL701819,Compound was tested in vitro for inhibition of human mixed lymphocyte proliferation (HuMLR),C=CC[C@@H]1/C=C(\C)C[C@H](C)C[C@H](OC)[C@H]2O[C@@](O)(C(=O)C(=O)N3CCCC[C@H]3C(=O)O[C@H](/C(C)=C/[C@@H]3CC[C@@H](O)[C@H](OC)C3)[C@H](C)[C@@H](O)CC1=O)[C@H](C)C[C@@H]2OC,,,CHEMBL1130792,Bioorg Med Chem Lett,1998,CHEMBL269732,TACROLIMUS ANHYDROUS,CHEMBL269732,9.43,342760,=,1,1,=,,IC50,nM,0.37,CHEMBL372,Homo sapiens,Homo sapiens,9606,IC50,nM,UO_0000065,0.37,0
378107,CHEMBL841401,Inhibitory activity against LPS-stimulated IL-1 beta release from human monocytes,COc1cc2c(c(C)c1OC)CCC(=O)C2C,,,CHEMBL1130726,Bioorg Med Chem Lett,1998,CHEMBL121430,,CHEMBL121430,9.72,230950,=,1,1,=,,IC50,nM,0.19,CHEMBL372,Homo sapiens,Homo sapiens,9606,IC50,nM,UO_0000065,0.19,0
631329,CHEMBL702141,Inhibition of human vascular smooth muscle proliferation was determined,O=C(N[C@@H](CCC(=O)N1CCN(c2cccc(NC3=NCCN3)c2)CC1)C(=O)O)OCc1ccccc1,,,CHEMBL1146737,Bioorg Med Chem Lett,2004,CHEMBL87130,,CHEMBL87130,8.52,155708,=,1,1,=,,IC50,nM,3.0,CHEMBL372,Homo sapiens,Homo sapiens,9606,IC50,nM,UO_0000065,3.0,0
1488764,CHEMBL833925,Inhibition of ADP-induced aggregation of human platelets,O=C(O)COc1cccc(C[C@@H]2CCC=CC2(O)c2nc(-c3ccccc3)c(-c3ccccc3)o2)c1,,,CHEMBL1140242,Bioorg Med Chem Lett,2005,CHEMBL363405,,CHEMBL363405,7.01,387230,=,1,1,=,,IC50,nM,98.0,CHEMBL372,Homo sapiens,Homo sapiens,9606,IC50,nM,UO_0000065,98.0,1
1488234,CHEMBL833925,Inhibition of ADP-induced aggregation of human platelets,O=C([O-])COc1cccc(C[C@@H]2CCC=C2c2nc(-c3ccccc3)c(-c3ccccc3)o2)c1.[Na+],,,CHEMBL1140242,Bioorg Med Chem Lett,2005,CHEMBL363350,,CHEMBL1207206,7.25,387206,=,1,1,=,,IC50,nM,56.0,CHEMBL372,Homo sapiens,Homo sapiens,9606,IC50,nM,UO_0000065,56.0,1
334320,CHEMBL699152,In vitro inhibition of ADP-induced human platelet aggregation.,CCOCCS(=O)(=O)N[C@@H](CNC(=O)c1ccc2c(c1)C(=O)N(CCC1CCNCC1)C2)C(=O)O,,,CHEMBL1129711,Bioorg Med Chem Lett,1996,CHEMBL313176,,CHEMBL313176,8.1,151568,=,1,1,=,,IC50,nM,8.0,CHEMBL372,Homo sapiens,Homo sapiens,9606,IC50,nM,UO_0000065,8.0,0
561973,CHEMBL759885,"Inhibitory activity against platelet aggregation, induced by arachidonic acid in human platelet rich plasma",O=C(O)c1cccc(CCC2C3CCC(O3)C2c2nc(C(=O)NCCCCC3CCCCC3)co2)c1,,,CHEMBL1126688,J Med Chem,1993,CHEMBL286708,,CHEMBL286708,6.96,47553,=,1,1,=,,IC50,nM,110.0,CHEMBL372,Homo sapiens,Homo sapiens,9606,I50,nM,UO_0000065,110.0,1
1120256,CHEMBL761040,Effect on production of LTB4 in human polymorphonuclear leukocytes,CC1Cc2c(OCc3ccc(-c4ccccc4)cn3)ccc3c2c(c(CCOC(C)(C)C(=O)O)n3Cc2ccc(Cl)cc2)S1,,,CHEMBL1127635,J Med Chem,1994,CHEMBL278027,,CHEMBL278027,8.15,18618,=,1,1,=,,IC50,nM,7.0,CHEMBL372,Homo sapiens,Homo sapiens,9606,IC50,nM,UO_0000065,7.0,0
1761810,CHEMBL870490,Inhibition of ADP-induced platelet aggregation in human platelet rich plasma,O=C(O)COc1cccc2c1CC[C@](O)(COC(=O)N(c1ccccc1F)c1ccccc1F)C2,,,CHEMBL1146874,Bioorg Med Chem Lett,2006,CHEMBL209804,,CHEMBL209804,7.2,554513,=,1,1,=,,IC50,nM,63.0,CHEMBL372,Homo sapiens,Homo sapiens,9606,IC50,nM,UO_0000065,63.0,1
1129845,CHEMBL856445,Effect on production of LTB4 in human polymorphonuclear (HPMN) leukocytes,CC1Cc2c(OCc3ccc(-c4ccccc4)cn3)ccc3c2c(c(CCOC(C)c2nn[nH]n2)n3Cc2ccc(Cl)cc2)S1,,,CHEMBL1127635,J Med Chem,1994,CHEMBL16334,,CHEMBL16334,8.0,18612,=,1,1,=,,IC50,nM,10.0,CHEMBL372,Homo sapiens,Homo sapiens,9606,IC50,nM,UO_0000065,10.0,0
303665,CHEMBL698689,In vitro inhibition of histamine release from human basophils,c1cc(Nc2nccc(-c3cccs3)n2)cc(OCCn2ccnc2)c1,,,CHEMBL1126800,J Med Chem,1993,CHEMBL94006,,CHEMBL94006,7.0,168438,=,1,1,=,,IC50,nM,100.0,CHEMBL372,Homo sapiens,Homo sapiens,9606,IC50,uM,UO_0000065,0.1,1
1761813,CHEMBL870490,Inhibition of ADP-induced platelet aggregation in human platelet rich plasma,O=C(O)COc1cccc2c1CC[C@](O)(COC(=O)N(c1ccccc1)c1ccc(Br)cc1)C2,,,CHEMBL1146874,Bioorg Med Chem Lett,2006,CHEMBL213334,,CHEMBL213334,7.31,554510,=,1,1,=,,IC50,nM,49.0,CHEMBL372,Homo sapiens,Homo sapiens,9606,IC50,nM,UO_0000065,49.0,1
551432,CHEMBL702585,In vitro inhibitory activity against superoxide production from human neutrophils stimulated with f-MLP,CCOc1ccc(-c2nc(-c3cccc(C(=O)O)n3)cs2)cc1OCC,,,CHEMBL1128742,J Med Chem,1995,CHEMBL332750,TETOMILAST,CHEMBL332750,7.16,226487,=,1,1,=,,IC50,nM,70.0,CHEMBL372,Homo sapiens,Homo sapiens,9606,IC50,uM,UO_0000065,0.07,1
339370,CHEMBL699152,In vitro inhibition of ADP-induced human platelet aggregation.,O=C(NC[C@H](NS(=O)(=O)c1cccs1)C(=O)O)c1ccc2c(c1)C(=O)N(CCC1CCNCC1)C2,,,CHEMBL1129711,Bioorg Med Chem Lett,1996,CHEMBL314622,,CHEMBL314622,8.15,151573,=,1,1,=,,IC50,nM,7.0,CHEMBL372,Homo sapiens,Homo sapiens,9606,IC50,nM,UO_0000065,7.0,0
935476,CHEMBL821741,In vitro cytotoxicity in Human ovary tumor cells,Oc1ccc(C(=NNc2ccccc2)c2ccc(O)cc2)cc1,,,CHEMBL1145129,J Med Chem,2003,CHEMBL344842,,CHEMBL344842,,272384,=,1,1,=,,IC50,ug.mL-1,6.2,CHEMBL372,Homo sapiens,Homo sapiens,9606,IC50,ug ml-1,UO_0000274,6.2,0
51934,CHEMBL764816,Inhibitory activity of Ca-ionophore-A23187-induced Leukotriene B4 (LTB4) release in human polymorphonuclear leukocytes,CS(=O)(=O)Nc1ccc2oc(NC(CC3CCCCC3)c3ccccc3)nc2c1,,,CHEMBL1127687,J Med Chem,1994,CHEMBL355495,,CHEMBL355495,6.8,341204,=,1,1,=,,IC50,nM,160.0,CHEMBL372,Homo sapiens,Homo sapiens,9606,IC50,uM,UO_0000065,0.16,1
580384,CHEMBL759883,"Inhibitory activity against platelet aggregation, induced by arachidonic acid in human platelet rich plasma",C#CCCCCCNC(=O)c1coc(C2C3CCC(O3)C2Cc2ccccc2CCC(=O)O)n1,,,CHEMBL1126688,J Med Chem,1993,CHEMBL416943,,CHEMBL416943,7.85,47514,=,1,1,=,,IC50,nM,14.0,CHEMBL372,Homo sapiens,Homo sapiens,9606,I 50,nM,UO_0000065,14.0,0
1212560,CHEMBL840545,Inhibition of collagen-induced platelet aggregation in human platelet-rich plasma,CC(C)(C(=O)N1CCC(CC(=O)O)CC1)C(NC(=O)c1ccc(C(=N)N)cc1)c1cccc(O)c1,,,CHEMBL1130999,J Med Chem,1998,CHEMBL77113,,CHEMBL77113,7.12,137822,=,1,1,=,,IC50,nM,76.0,CHEMBL372,Homo sapiens,Homo sapiens,9606,IC50,uM,UO_0000065,0.076,1
717663,CHEMBL701818,Inhibition of human mixed lymphocyte response (MLR),CC[C@@H]1/C=C(\C)C[C@H](C)C[C@H](OC)[C@H]2O[C@@](O)(C(=O)C(=O)N3CCCC[C@H]3C(=O)O[C@H](/C(C)=C/C3CC[C@@H](OCC(=O)Nc4ccc(C)cc4)[C@H](OC)C3)[C@H](C)[C@@H](O)CC1=O)[C@H](C)C[C@@H]2OC,,,CHEMBL1131619,J Med Chem,1998,CHEMBL295945,,CHEMBL295945,10.7,83907,=,1,1,=,,IC50,nM,0.02,CHEMBL372,Homo sapiens,Homo sapiens,9606,IC50,nM,UO_0000065,0.02,0
1104822,CHEMBL761040,Effect on production of LTB4 in human polymorphonuclear leukocytes,CCC(OCCc1c2c3c(c(OCc4ccc(-c5ccccc5)cn4)ccc3n1Cc1ccc(Cl)cc1)CC(C)S2)C(=O)O,,,CHEMBL1127635,J Med Chem,1994,CHEMBL275634,,CHEMBL275634,8.15,18634,=,1,1,=,,IC50,nM,7.0,CHEMBL372,Homo sapiens,Homo sapiens,9606,IC50,nM,UO_0000065,7.0,0
698059,CHEMBL844625,Inhibitory activity against Leukotriene (LTB4) biosynthesis in isolated human polymorphonuclear cells (PMNs),Oc1cc2c(cc1SCc1ccccc1)OCC2,,,CHEMBL1124454,J Med Chem,1989,CHEMBL7675,,CHEMBL7675,6.96,2352,=,1,1,=,,IC50,nM,110.0,CHEMBL372,Homo sapiens,Homo sapiens,9606,IC50,nM,UO_0000065,110.0,1
1248452,CHEMBL700474,Inhibition of aggregation of human gel-filtered platelets was measured by light transmittance method.,CCCCS(=O)(=O)N[C@@H](CNC(=O)c1cc2n(n1)CCCN(CCC1CCNCC1)C2=O)C(=O)O,,,CHEMBL1130054,J Med Chem,1997,CHEMBL300525,,CHEMBL300525,8.0,85029,=,1,1,=,,IC50,nM,10.0,CHEMBL372,Homo sapiens,Homo sapiens,9606,IC50,nM,UO_0000065,10.0,0
450590,CHEMBL697158,In vitro inhibitory potency against human gel filtered platelet (GFP) aggregation,O=C(O)C[C@@H](NC(=O)[C@@H]1CCCN(C(=O)CCC2CCNCC2)C1)c1cccnc1,,,CHEMBL1132284,J Med Chem,1999,CHEMBL150533,,CHEMBL150533,7.22,292278,=,1,1,=,,IC50,nM,60.0,CHEMBL372,Homo sapiens,Homo sapiens,9606,IC50,uM,UO_0000065,0.06,1
1294957,CHEMBL701919,Inhibition of LPS-induced TNF-alpha production in human whole blood,COc1ccc(C2(C#N)CCN(CC(=O)NO)CC2)cc1OCC1CC1,,,CHEMBL1146692,Bioorg Med Chem Lett,2004,CHEMBL65114,,CHEMBL65114,8.68,114061,=,1,1,=,,IC50,nM,2.1,CHEMBL372,Homo sapiens,Homo sapiens,9606,IC50,uM,UO_0000065,0.0021,0
25108194,CHEMBL5264045,Immunosuppressive activity in human T cell,Cc1nc2ccc(CN(C)c3ccc(C(=O)N[C@@H](C[C@@H](F)C(=O)O)C(=O)O)s3)cc2c(=O)[nH]1,,,CHEMBL5260833,Eur J Med Chem,2018,CHEMBL5272580,,CHEMBL5272580,8.25,3938451,=,1,1,=,,IC50,nM,5.67,CHEMBL372,Homo sapiens,Homo sapiens,9606,IC50,nM,UO_0000065,5.67,0
359102,CHEMBL700565,Compound was evaluated for GROalpha-mediated calcium mobilization in human polymorphonuclear neutrophils(PMNs),N#Cc1ccc(NC(=O)Nc2ccccc2Br)c(O)c1,,,CHEMBL1149089,J Med Chem,2004,CHEMBL27863,,CHEMBL27863,7.28,36910,=,1,1,=,,IC50,nM,53.0,CHEMBL372,Homo sapiens,Homo sapiens,9606,IC50,nM,UO_0000065,53.0,1
371803,CHEMBL873457,Inhibition of ADP-induced human platelet rich plasma aggregation,CC(=O)Oc1ccccc1C(=O)OCCCOc1no[n+]([O-])c1S(=O)(=O)c1ccccc1,Outside typical range,"Values for this activity type are unusually large/small, so may not be accurate",CHEMBL1145772,J Med Chem,2003,CHEMBL351742,,CHEMBL351742,,322560,=,1,1,=,,IC50,nM,0.001122,CHEMBL372,Homo sapiens,Homo sapiens,9606,pIC50(uM),,UO_0000065,5.95,0
631814,CHEMBL842220,Inhibition of TNF-alpha synthesis in human monocytes,COc1ccc2c(Cc3c(Cl)cncc3Cl)nnc(-c3nccs3)c2c1,,,CHEMBL1134046,Bioorg Med Chem Lett,2001,CHEMBL79471,,CHEMBL79471,8.1,232427,=,1,1,=,,IC50,nM,8.0,CHEMBL372,Homo sapiens,Homo sapiens,9606,IC50,nM,UO_0000065,8.0,0
1131892,CHEMBL873206,In vitro inhibitory activity against LTB4 synthesis in A-23187 stimulated human whole blood (HB1).,COC1(c2csc(Sc3ccc4c(c3)CC/C4=N\O)c2)CCOCC1,,,CHEMBL1129182,Bioorg Med Chem Lett,1996,CHEMBL283523,,CHEMBL283523,6.89,36609,=,1,1,=,,IC50,nM,130.0,CHEMBL372,Homo sapiens,Homo sapiens,9606,IC50,uM,UO_0000065,0.13,1
57016,CHEMBL763559,Concentration required for maximal in vitro inhibition of aggregation of human platelet rich plasma (hPRP),Cc1cccc(S(=O)(=O)N[C@@H](CNC(=O)C[C@H]2CC(c3ccc(C(=N)N)cc3)=NO2)C(=O)O)c1,,,CHEMBL1133917,Bioorg Med Chem Lett,2001,CHEMBL71624,,CHEMBL71624,7.3,123899,=,1,1,=,,IC50,nM,50.0,CHEMBL372,Homo sapiens,Homo sapiens,9606,IC50,uM,UO_0000065,0.05,1
586270,CHEMBL698309,Inhibitory activity against ADP-mediated human platelet aggregation in human platelet rich plasma,O=C(O)COc1ccc(C(=O)CNC(=O)c2cc3c(s2)CCNC3)cc1OCC(=O)O,,,CHEMBL1128920,Bioorg Med Chem Lett,1996,CHEMBL315036,,CHEMBL315036,6.8,159247,=,1,1,=,,IC50,nM,160.0,CHEMBL372,Homo sapiens,Homo sapiens,9606,IC50,uM,UO_0000065,0.16,1
66151,CHEMBL764816,Inhibitory activity of Ca-ionophore-A23187-induced Leukotriene B4 (LTB4) release in human polymorphonuclear leukocytes,Clc1ccccc1C(CC1CCCCC1)Nc1nc2ccccc2o1,,,CHEMBL1127687,J Med Chem,1994,CHEMBL173903,,CHEMBL173903,7.1,341200,=,1,1,=,,IC50,nM,80.0,CHEMBL372,Homo sapiens,Homo sapiens,9606,IC50,uM,UO_0000065,0.08,1
563921,CHEMBL697935,In vitro inhibitory activity was evaluated against human squalence epoxidase,CN(C/C=C/C#CC(C)(C)C)Cc1cccc(OCC(C)(C)OCc2ccsc2)c1,,,CHEMBL1148267,Bioorg Med Chem Lett,2004,CHEMBL346067,,CHEMBL346067,7.96,309142,=,1,1,=,,IC50,nM,11.0,CHEMBL372,Homo sapiens,Homo sapiens,9606,IC50,nM,UO_0000065,11.0,0
1401556,CHEMBL834299,In vitro metabolic stability of compound was tested in human liver microsomes,CCc1cc2cc(C(=O)[C@H]3CC[C@@H](OC)CC3)ccc2nc1F,,,CHEMBL1144351,J Med Chem,2005,CHEMBL2112964,,CHEMBL2112964,7.12,360175,=,1,1,=,,IC50,nM,75.0,CHEMBL372,Homo sapiens,Homo sapiens,9606,IC50,nM,UO_0000065,75.0,1
36032,CHEMBL764816,Inhibitory activity of Ca-ionophore-A23187-induced Leukotriene B4 (LTB4) release in human polymorphonuclear leukocytes,O=[N+]([O-])c1ccc2oc(NC(Cc3ccc(F)cc3)c3ccccn3)nc2c1,,,CHEMBL1127687,J Med Chem,1994,CHEMBL174239,,CHEMBL174239,7.8,341233,=,1,1,=,,IC50,nM,16.0,CHEMBL372,Homo sapiens,Homo sapiens,9606,IC50,uM,UO_0000065,0.016,0
743198,CHEMBL701818,Inhibition of human mixed lymphocyte response (MLR),CC[C@@H]1/C=C(\C)C[C@H](C)C[C@H](OC)[C@H]2O[C@@](O)(C(=O)C(=O)N3CCCC[C@H]3C(=O)O[C@H](/C(C)=C/C3CC[C@@H](OCC(=O)O)[C@H](OC)C3)[C@H](C)[C@@H](O)CC1=O)[C@H](C)C[C@@H]2OC,,,CHEMBL1131619,J Med Chem,1998,CHEMBL51516,,CHEMBL51516,6.85,83904,=,1,1,=,,IC50,nM,140.0,CHEMBL372,Homo sapiens,Homo sapiens,9606,IC50,nM,UO_0000065,140.0,1
1207373,CHEMBL871976,Inhibition of LPS/IFN-gamma stimulated TNF-alpha release in human peripheral blood mononuclear cells after 3h of incubation.,C[C@H](Nc1cc(-c2sc(C3(O)CCN(C)CC3)nc2-c2ccc(F)cc2)ccn1)c1ccccc1,,,CHEMBL1147483,Bioorg Med Chem Lett,2004,CHEMBL118419,,CHEMBL118419,9.0,227460,=,1,1,=,,IC50,nM,1.0,CHEMBL372,Homo sapiens,Homo sapiens,9606,IC50,uM,UO_0000065,0.001,0
303435,CHEMBL696392,Inhibition of ADP-induced platelet aggregation in human gel-filtered platelets,CC1(C)C2CCC1(Cc1ccc(S(=O)(=O)N[C@@H](CNC(=O)c3cc4cc(OCC5CCNCC5)ccc4[nH]3)C(=O)O)cc1)C(=O)C2,,,CHEMBL1151560,Bioorg Med Chem Lett,1997,CHEMBL94393,,CHEMBL94393,7.77,174757,=,1,1,=,,IC50,nM,17.0,CHEMBL372,Homo sapiens,Homo sapiens,9606,IC50,nM,UO_0000065,17.0,0
276604,CHEMBL696392,Inhibition of ADP-induced platelet aggregation in human gel-filtered platelets,O=C(NC[C@H](NS(=O)(=O)c1ccccc1)C(=O)O)c1cc2cc(OCCN3CCNCC3)ccc2[nH]1,,,CHEMBL1151560,Bioorg Med Chem Lett,1997,CHEMBL96174,,CHEMBL96174,7.92,174754,=,1,1,=,,IC50,nM,12.0,CHEMBL372,Homo sapiens,Homo sapiens,9606,IC50,nM,UO_0000065,12.0,0
36021,CHEMBL763979,Inhibition of human platelet aggregation induced by ADP after 3 min incubation with platelet rich plasma,Cl.O=C(NCCCOc1ccc2[nH]c3nc(O)nc-3cc2c1)N1CCN(Cc2ccc(F)cc2)CC1,,,CHEMBL1126868,J Med Chem,1993,CHEMBL1203057,,CHEMBL113360,9.46,208526,=,1,1,=,,IC50,nM,0.35,CHEMBL372,Homo sapiens,Homo sapiens,9606,IC50,nM,UO_0000065,0.35,0
621120,CHEMBL729970,Inhibition of VEGF-stimulated migration of human microvascular endothelial cells,CC(C)(C)OC(=O)N[C@H](CCCCN)C(=O)Nc1ccc(C(=O)O)c(-c2ccc(O)cc2)c1,,,CHEMBL1146719,Bioorg Med Chem Lett,2004,CHEMBL433611,,CHEMBL433611,10.7,346354,=,1,1,=,,IC50,nM,0.02,CHEMBL372,Homo sapiens,Homo sapiens,9606,IC50,nM,UO_0000065,0.02,0
520176,CHEMBL759889,Compound was tested for its inhibitory activity against platelet aggregation induced by collagen in human platelet-rich plasma,N#Cc1c(-c2ccccc2)no[n+]1[O-],,,CHEMBL1127832,J Med Chem,1994,CHEMBL336467,FUROXAN,CHEMBL336467,6.7,265981,=,1,1,=,,IC50,nM,199.0,CHEMBL372,Homo sapiens,Homo sapiens,9606,IC50,M,UO_0000065,1.99e-07,1
317869,CHEMBL702330,In vitro inhibition of LTB4 biosynthesis in A-23187-stimulated human whole blood,CO[C@]1(c2cc(F)cc(OCc3ccc4c(ccc(=O)n4C)c3)c2)CCO[C@H](C)C1,,,CHEMBL1126825,J Med Chem,1993,CHEMBL431230,,CHEMBL431230,6.85,186792,=,1,1,=,,IC50,nM,140.0,CHEMBL372,Homo sapiens,Homo sapiens,9606,IC50,uM,UO_0000065,0.14,1
66152,CHEMBL764816,Inhibitory activity of Ca-ionophore-A23187-induced Leukotriene B4 (LTB4) release in human polymorphonuclear leukocytes,CC(C)c1ccc2oc(NC(Cc3ccc(F)cc3)c3ccccn3)nc2c1,,,CHEMBL1127687,J Med Chem,1994,CHEMBL354312,,CHEMBL354312,7.92,341234,=,1,1,=,,IC50,nM,12.0,CHEMBL372,Homo sapiens,Homo sapiens,9606,IC50,uM,UO_0000065,0.012,0
68601,CHEMBL763979,Inhibition of human platelet aggregation induced by ADP after 3 min incubation with platelet rich plasma,Cl.O=S(=O)(CCCOc1ccc2[nH]c3nc(O)nc-3cc2c1)C1CCN(CC2CCCCC2)CC1,,,CHEMBL1126868,J Med Chem,1993,CHEMBL1203024,,CHEMBL110959,10.52,208539,=,1,1,=,,IC50,nM,0.03,CHEMBL372,Homo sapiens,Homo sapiens,9606,IC50,nM,UO_0000065,0.03,0
1124955,CHEMBL761040,Effect on production of LTB4 in human polymorphonuclear leukocytes,CC1Cc2c(OCc3ccc(-c4ccccc4)cn3)ccc3c2c(c(CCOCCC(=O)O)n3Cc2ccc(Cl)cc2)S1,,,CHEMBL1127635,J Med Chem,1994,CHEMBL16244,,CHEMBL16244,7.96,18624,=,1,1,=,,IC50,nM,11.0,CHEMBL372,Homo sapiens,Homo sapiens,9606,IC50,nM,UO_0000065,11.0,0
1289748,CHEMBL697907,Tested for the ability to inhibit arachidonic acid induced platelet aggregation in human platelet rich plasma,O=C(O)CCc1ccccc1C[C@@H]1CCC[C@@H]1c1nc(C(=O)NCCCCC2CCCCC2)co1,,,CHEMBL1126505,Bioorg Med Chem Lett,1993,CHEMBL22244,,CHEMBL22244,6.97,31431,=,1,1,=,,IC50,nM,107.0,CHEMBL372,Homo sapiens,Homo sapiens,9606,I50,uM,UO_0000065,0.107,1
62154,CHEMBL763559,Concentration required for maximal in vitro inhibition of aggregation of human platelet rich plasma (hPRP),Cc1ccccc1S(=O)(=O)N[C@@H](CNC(=O)C[C@H]1CC(c2ccc(C(=N)N)cc2)=NO1)C(=O)O,,,CHEMBL1133917,Bioorg Med Chem Lett,2001,CHEMBL71016,,CHEMBL71016,7.27,123895,=,1,1,=,,IC50,nM,54.0,CHEMBL372,Homo sapiens,Homo sapiens,9606,IC50,uM,UO_0000065,0.054,1
930726,CHEMBL695826,Inhibitory activity against human concanavalin-A proliferation assay,COC(=O)N(O)[C@@H]1C[C@@H]2CC[C@@H](C)[C@@](O)(O2)C(=O)C(=O)N2CCCC[C@H]2C(=O)O[C@H]([C@H](C)C[C@@H]2CC[C@@H](O)[C@H](OC)C2)CC(=O)[C@H](C)/C=C(\C)[C@@H](O)[C@@H](OC)C(=O)[C@H](C)C[C@H](C)/C=C/C=C/C=C/1C,,,CHEMBL1133206,Bioorg Med Chem Lett,2000,CHEMBL216952,,CHEMBL216952,7.8,46573,=,1,1,=,,IC50,nM,16.0,CHEMBL372,Homo sapiens,Homo sapiens,9606,IC50,nM,UO_0000065,16.0,0
1054202,CHEMBL842236,Compound was tested for inhibitory activity against leukotriene B4 induced neutrophil chemotaxis,CCCc1c(OCCCOc2ccc(C(=O)N(C)C)c(OC)c2CCC)ccc2c1OC(C(=O)O)CC2,,,CHEMBL1150529,Bioorg Med Chem Lett,1994,CHEMBL167350,,CHEMBL167350,,329427,<,1,1,<,,IC50,nM,0.14,CHEMBL372,Homo sapiens,Homo sapiens,9606,IC50,nM,UO_0000065,0.14,0
1401571,CHEMBL834299,In vitro metabolic stability of compound was tested in human liver microsomes,CCc1cc2cc(C(=O)[C@H]3CC[C@@H](OC)CC3)ccc2nc1N,,,CHEMBL1144351,J Med Chem,2005,CHEMBL2112967,,CHEMBL2112967,7.17,360189,=,1,1,=,,IC50,nM,68.0,CHEMBL372,Homo sapiens,Homo sapiens,9606,IC50,nM,UO_0000065,68.0,1
317209,CHEMBL768604,In vitro inhibition of U 46619 induced aggregation of washed platelets,Cc1ccc(S(=O)(=O)NCCCCC(CCCc2cccnc2)CCC(=O)O)cc1,,,CHEMBL1126283,J Med Chem,1992,CHEMBL435590,,CHEMBL435590,7.24,264748,=,1,1,=,,IC50,nM,58.0,CHEMBL372,Homo sapiens,Homo sapiens,9606,IC50,uM,UO_0000065,0.058,1
148636,CHEMBL811521,Concentration required to reduce the proliferation of PHA stimulated human peripheral blood T lymphocytes,C=Cc1cn(CCC(CO)CO)c(=O)[nH]c1=O,,,CHEMBL1133838,Bioorg Med Chem Lett,2001,CHEMBL317723,,CHEMBL317723,,184065,>,1,1,>,,IC50,ug.mL-1,50.0,CHEMBL372,Homo sapiens,Homo sapiens,9606,IC50,ug ml-1,UO_0000274,50.0,1
1078127,CHEMBL697025,Concentration to achieve half-maximal inhibition of acid-induced swelling in human platelets using platelet swelling assay,CCC1(O)CS(=O)(=O)c2cc(C(=O)N=C(N)N)c(C)cc21,,,CHEMBL1131104,J Med Chem,1998,CHEMBL333059,,CHEMBL333059,7.11,234827,=,1,1,=,,IC50,nM,77.0,CHEMBL372,Homo sapiens,Homo sapiens,9606,IC50,nM,UO_0000065,77.0,1
925779,CHEMBL821741,In vitro cytotoxicity in Human ovary tumor cells,CC(=O)c1ccc2c(/N=N/c3ccc([N+](=O)[O-])cc3[N+](=O)[O-])c3cccc(C(C)=O)c3c(O)c2c1,,,CHEMBL1145129,J Med Chem,2003,CHEMBL341929,,CHEMBL341929,,272366,=,1,1,=,,IC50,ug.mL-1,0.3,CHEMBL372,Homo sapiens,Homo sapiens,9606,IC50,ug ml-1,UO_0000274,0.3,0
296220,CHEMBL698689,In vitro inhibition of histamine release from human basophils,CCN(CC)CCOc1ccc(Nc2nccc(-c3ccncc3)n2)cc1,,,CHEMBL1126800,J Med Chem,1993,CHEMBL92149,,CHEMBL92149,6.7,168353,=,1,1,=,,IC50,nM,200.0,CHEMBL372,Homo sapiens,Homo sapiens,9606,IC50,uM,UO_0000065,0.2,1
1293826,CHEMBL696575,In vitro inhibition of platelet aggregation using Human platelet-Rich Plasma,Cc1ccc(S(=O)(=O)N[C@@H](CNC(=O)c2ccc3oc(-c4ccc(C(=N)N)cc4)nc3c2)C(=O)O)cc1,,,CHEMBL1128969,Bioorg Med Chem Lett,1996,CHEMBL114119,,CHEMBL114119,8.0,218652,=,1,1,=,,IC50,nM,10.0,CHEMBL372,Homo sapiens,Homo sapiens,9606,IC50,uM,UO_0000065,0.01,0
1200633,CHEMBL871976,Inhibition of LPS/IFN-gamma stimulated TNF-alpha release in human peripheral blood mononuclear cells after 3h of incubation.,OC1(c2nc(-c3ccc(F)cc3)c(-c3ccnc(NC4CCCCC4)c3)o2)CCNCC1,,,CHEMBL1147483,Bioorg Med Chem Lett,2004,CHEMBL121405,,CHEMBL121405,9.7,227470,=,1,1,=,,IC50,nM,0.2,CHEMBL372,Homo sapiens,Homo sapiens,9606,IC50,uM,UO_0000065,0.0002,0
1021333,CHEMBL697027,in vitro inhibition of human gel-filtered platelets using ADP agonist,C#C[C@H](CC(=O)O)NC(=O)CN1CCc2ccc(-c3ccncc3)cc2C1=O,,,CHEMBL1129398,J Med Chem,1996,CHEMBL140593,,CHEMBL140593,6.8,273378,=,1,1,=,,IC50,nM,160.0,CHEMBL372,Homo sapiens,Homo sapiens,9606,IC50,nM,UO_0000065,160.0,1
327034,CHEMBL768604,In vitro inhibition of U 46619 induced aggregation of washed platelets,O=C(O)CCC(CCCCNS(=O)(=O)c1ccc(Cl)cc1)CCOc1cccnc1,,,CHEMBL1126283,J Med Chem,1992,CHEMBL63904,,CHEMBL63904,7.89,264753,=,1,1,=,,IC50,nM,13.0,CHEMBL372,Homo sapiens,Homo sapiens,9606,IC50,uM,UO_0000065,0.013,0
559910,CHEMBL759885,"Inhibitory activity against platelet aggregation, induced by arachidonic acid in human platelet rich plasma",O=C(O)CCc1ccccc1CC1C2CCC(O2)C1c1nc(C(=O)NCCc2ccccc2)co1,,,CHEMBL1126688,J Med Chem,1993,CHEMBL410732,,CHEMBL410732,8.05,47532,=,1,1,=,,IC50,nM,9.0,CHEMBL372,Homo sapiens,Homo sapiens,9606,I50,nM,UO_0000065,9.0,0
1751875,CHEMBL868608,Inhibition of LPS-induced TNFalpha production in human whole blood,CC(C)c1nnc2ccc(-c3ocnc3-c3cc(Cl)ccc3F)cn12,,,CHEMBL1145312,Bioorg Med Chem Lett,2006,CHEMBL212238,,CHEMBL212238,6.72,528642,=,1,1,=,,IC50,nM,190.0,CHEMBL372,Homo sapiens,Homo sapiens,9606,IC50,nM,UO_0000065,190.0,1
62186,CHEMBL764816,Inhibitory activity of Ca-ionophore-A23187-induced Leukotriene B4 (LTB4) release in human polymorphonuclear leukocytes,CCOC(=O)[C@H](Cc1ccccc1)Nc1nc2ccccc2o1,,,CHEMBL1127687,J Med Chem,1994,CHEMBL2110338,,CHEMBL2110338,6.82,341183,=,1,1,=,,IC50,nM,150.0,CHEMBL372,Homo sapiens,Homo sapiens,9606,IC50,uM,UO_0000065,0.15,1
1089543,CHEMBL872818,In vitro inhibition of ADP-induced platelet aggregation in human platelet rich plasma.,CCCCC[C@H](O)/C=C/C1C(=O)CC(O)[C@@H]1C/C=C\CCCC(=O)O,,,CHEMBL1122225,J Med Chem,1983,CHEMBL165001,,CHEMBL165001,,327318,=,1,1,=,,IC50,ug.mL-1,0.0001,CHEMBL372,Homo sapiens,Homo sapiens,9606,IC50,ng ml-1,UO_0000274,0.1,0
1404765,CHEMBL834775,Inhibitory concentration against gel filtered platelet aggregation induced by alpha thrombin,CN[C@H](Cc1ccccc1)C(=O)N1CCC[C@H]1C(=O)N[C@H](C=O)CCCN=C(N)N,,,CHEMBL1142732,J Med Chem,2005,CHEMBL273196,EFEGATRAN,CHEMBL273196,7.08,361129,=,1,1,=,,IC50,nM,83.0,CHEMBL372,Homo sapiens,Homo sapiens,9606,IC50,nM,UO_0000065,83.0,1
234038,CHEMBL763984,Inhibitory concentration of compound in human platelet rich plasma against 2 umol of ADP-induced aggregation,CCCCC[C@H](O)/C=C/[C@@H]1[C@H]2C(=O)/C(=C/CCCC(=O)[O-])O[C@H]2C[C@H]1O.[Na+],,,CHEMBL1121996,J Med Chem,1982,CHEMBL268952,,CHEMBL1206391,,6551,=,1,1,=,,IC50,ug.mL-1,0.015,CHEMBL372,Homo sapiens,Homo sapiens,9606,IC50,ng ml-1,UO_0000274,15.0,0
1126897,CHEMBL878772,Compound was evaluated for production of leukotriene B4 in Ca+2 -ionophore -activated human polymorphonuclear (HPMN) leukocytes.,N#Cc1cc(-c2ccoc2)c2ccc(OCc3cc(C4(O)CCOCC4)ccn3)cc2c1,,,CHEMBL1130137,J Med Chem,1997,CHEMBL99942,,CHEMBL99942,8.46,180616,=,1,1,=,,IC50,nM,3.5,CHEMBL372,Homo sapiens,Homo sapiens,9606,IC50,nM,UO_0000065,3.5,0
